"id","title","upload_date"
"usZD1T9qPZo","(ASMR) Leon Buys You A Fresh New Snapback - Pokemon Sword","2020-02-20"
"L0GdRE17_co","(Tainted) Lost the Game - The Binding of Isaac: Repentance","2022-06-28"
"xUtlSlxylVU","1 Laugh = 1 Smelly BEAN ~ YLYL Jabroni Mike","2022-10-02"
"lLioOZ1tp5w","100% Boneless Juice - Jabroni Juicebox #6","2019-11-11"
"iA37plMHmiA","2.0 Tomfoolery - Animal Crossing: New Horizons","2021-11-08"
"jtq9D3X-0ps","35 Mayros Enter, 1 Mayro Leaves - Super Mario Bros. 35","2020-10-04"
"jPmhuvKsr8U","5 Things Plumbing and Ghost-Hunting Have in Common! 08/01/19","2019-08-02"
"ow0tDraiqaQ","50 Fake Retro Games in One! - UFO 50","2024-09-26"
"ZEJiG92SlXk","6 VTubers, 1 Fleshy - Lethal Company w/Snuffy, Hackerling, Limes, Fredrik Knudsen and More!","2023-12-09"
"1I3m_dLiIM4","8800 Blue Lick Road Investigation (w/ Fredrik Knudsen!)","2020-11-09"
"FKLMwd_iPho","9 Years of Jabroni Mike - Kahoot! + Jackbox","2024-02-15"
"_AA0tkaC1DQ","999 Streams - 9 Hours 9 Persons 9 Doors (Finale!)","2020-04-19"
"SuuhYTZOZSs","A 10-Year-Old teaches a Millenial to play Fortnite? 07/28/19","2019-07-30"
"j0LCe9QXikQ","A Bald and Red Beat 'Em Up RPG - Towerborne","2024-10-23"
"uoMXW8hAI0g","A Blasst From the Passt - Subnautica: Below Zero","2021-05-16"
"LFv3pxiKtGs","A Clear And Concise Narrative - Death Stranding (Finale!)","2020-02-06"
"3IQ-1-LV6sU","A Conkwork Orange - Conker's Bad Fur Day (Finale!)","2021-05-19"
"WQnLJUlrR4g","A Cosmic Hangover - Katamari Damacy Reroll","2020-04-21"
"evsZyYfACgQ","A Deranged Dinner - WarioWare: Get It Together","2021-09-17"
"un0yWBZGNFg","A Dungeon Crawlin' Good Time - Endless Dungeon","2022-07-04"
"2CI5bxWHAFk","A Flat Society - Paper Mario and the Origami King","2020-07-29"
"xsw8aTgz1O0","A Golden Stream - Pee Wars","2021-12-12"
"PbV6X3mz87I","A Good Game Gone Bad - Sonic Lost World (PART 2 Finale)","2022-10-07"
"BV2urWn7ryc","A Hat in Time - Part 1 - Jabroni Mike Full Streams","2018-10-04"
"TO85vtfK_ps","A Hat in Time - Part 2 - Jabroni Mike Full Streams","2018-10-12"
"RDVbBd8p1qA","A Hat in Time - Part 3 - Jabroni Mike Full Streams","2018-10-20"
"H7IU1Y8cmTQ","A Hero Cannot Be A Hero Unless In A Heroic World 07/31/19","2019-08-01"
"8jIyp3zfu3E","A Hogswappin' Good Time! - Sonic Heroes","2020-08-17"
"R7XHvlhMg9Y","A Janky Halloween - Night of the Nun","2021-11-04"
"jdZy5U6J0w0","A Japantastic Journey - Yakuza 0","2021-04-28"
"OCIyQYTkbGs","A Jiggly Sendoff - Shantae and the Seven Sirens (Finale)","2020-06-24"
"iMJhneTQDcM","A Maternal Marathon - Mother 3","2020-10-02"
"fkJQh7AkAkg","A Mech In Every Garage - No Man's Sky","2020-04-22"
"6MR_Yxvuw1s","A New Era of Twink Based Gaming - Lies of P - Jabroni Mike","2023-10-06"
"sBCSBzkLM4s","A New Low For Mobile Ads - Jabroni Mike","2023-05-10"
"QjXGqT8c4H0","A Night of Passion and Regret - Mario Kart 8 Deluxe","2021-02-03"
"WcEWzDPw3No","A Nightmarish Christmas - Puppet Combo Games","2021-12-25"
"Xht-9Z3t4Kw","A Positive, Happy Stream - Pokemon: Brilliant Diamond","2021-11-21"
"GrW6_HZ5JtM","A Post-Shrimp Island - Tomodachi Life","2021-11-11"
"giX_IjaXKU8","A Primarily Leftist Phenomenon - Animal Crossing: New Horizons","2020-05-16"
"D_OsrWG53FQ","A Rainy Afternoon - Animal Crossing: New Horizons","2020-09-03"
"XgwiLI7tOKE","A Saacy Surprise Inside! - The Binding of Isaac: Repentance","2021-07-30"
"eqiuBtsouOc","A Scaly Spectacular - Spyro: Reignited Trilogy","2021-04-24"
"4wXoiuQQnxw","A Seal and Two Babies - Valheim (w/ RevScarecrow and Limes!)","2021-03-25"
"3l83NFlAss8","A Series of UnFalltunate Events - Fall Guys","2020-09-11"
"ICPeyEuav_w","A Series Of Unfortunate Romances - Patreon Pledge Picks","2020-02-03"
"BSSXWDu3Xjc","A Shark's Tale - Raft (w/ RevScarecrow!)","2020-12-08"
"CZCIbw4LfdY","A Sophisticated Stream - The Quarry","2022-06-27"
"m3W2J8HMgRM","A Still More Glorious Dawn Awaits - The Outer Worlds","2019-10-29"
"tJc9AB86iFo","A Stream About Nothing - Quizzes + Geoguessr - Jabroni Mike","2023-08-09"
"rBQYS2AAE7o","A Stream About Nothing - YTP Reaction Night","2024-07-30"
"8KR1qmsChUU","A Truly Torturous Trip - Jabroni Mike in Florida IRL","2023-12-30"
"IVr93gjKmQU","A Twitch Chat Did It - Noita","2020-11-25"
"DtsVfnRNNcc","A Very Angry Italian - Mario Kart 8 Deluxe","2021-03-27"
"FL5PRqTY5Aw","A Very Expensive Costume - Animal Crossing: New Horizons","2020-10-03"
"su2sPdzCaAY","A Very Nostalgic YLYL","2024-08-17"
"9_YAlO8-6Zo","A Very Silly You Laugh You Lose","2024-08-04"
"uS4lMC1LO-U","A Very Special Episode of Mike","2016-06-16"
"MSXe4hDwjGc","A Very Tangent-Heavy YLYL","2024-06-22"
"NqHhta-7bXE","A Victory for Mental Health - Psychonauts","2022-01-12"
"MmpcIRGr2Ss","A Vorey Story - Mario and Luigi: Bowser's Inside Story","2022-04-30"
"69lOxV1YGec","A Way Out with Revscarecrow - Part 2 - Jabroni Mike Full Streams","2018-05-05"
"Za5G5W_xzzk","A Yellow Kiss - The Binding of Isaac: Repentance","2022-03-20"
"k--CADZ201E","A YLYL Deconstruction - Jabroni mike","2023-01-08"
"LF9dVA9uw6A","Abiotic Factor with Fredrik Knudsen and Revscarecrow","2024-05-13"
"U8si_Rjmveg","Absolutely Dreadful - Metroid Dread","2021-10-12"
"GAUWeR8b7AM","Absolutely No Fishing Memes - Terraria w/RevScarecrow!","2020-03-05"
"5UQAd0R3Fag","Abusing Neural Networks - AI Shenanigans (Dall E Mini, Open Ai, More!)","2022-06-25"
"lNPlbwjXWCk","Abzu - Jabroni Mike: Full Streams","2017-01-26"
"I1PKXL6SUxA","ACNL Fishing Tourney - 4/8/12 - Jabroni Mike: Full Streams","2017-04-08"
"u9ql90K3xMM","ACNL: Fireworks Show - 8/13/17 - Jabroni Mike: Full Streams","2017-08-14"
"oKq9ovy_GQ8","ACTUALLY Gaming - Marvel Rivals + ANTONBLAST","2024-12-11"
"xDOWHRGL0IY","Actually Yoshi's Island - Yoshi's Island","2022-03-20"
"djqUYL2Hnq8","Afterbirth + - Jabroni Mike: Full Streams","2017-01-13"
"ZCIxTEKyIm4","Afterbirth + - Jabroni Mike: Full Streams","2017-01-03"
"pr3N4WTs66U","Afterbirth + 1/16/17 - Jabroni Mike: Full Streams","2017-01-15"
"79aV5-k7YBk","Afterbirth + 1/6/17 - Jabroni Mike: Full Streams","2017-01-13"
"MLFWv_eQWiY","Afterbirth + 2/4/17 - Jabroni Mike: Full Streams","2017-02-03"
"WU-B8M2pgyo","AI Generated Unreal Estate w/@FredrikKnudsen  - Jabroni Mike","2023-09-28"
"MVQuNucgGLI","Ai Generating Pokemon","2022-09-28"
"ct0wdxyjSe0","AI Story Time Night - Jabroni Mike","2023-01-22"
"jXoqbPMcdBc","Akinator Hates Me - Browser Games","2024-07-15"
"a04GHRM6qhc","Aliem: Isolatiom Part2","2015-11-04"
"a0RQSOZewo8","Aliem: Isolatiom Part3","2015-11-04"
"vLHJwjQ1lW8","Aliem: Isolatiom Part3","2015-11-04"
"ewcXnov92HQ","Aliem: Isolatiom Part4","2015-11-04"
"v1k8CUG_nkc","Aliem: Isolatiom Part4","2015-11-04"
"b5QtnM3GFlc","Aliem: Isolatiom","2015-11-04"
"PGUj2Zq8laI","Alien Isolation - 1 / 2","2015-12-01"
"A6HHYfuXrqs","Alien Isolation - 2 / 2","2015-12-01"
"Wt09a-xg-Vg","All My Pals, Gone - Go Mecha Ball + Palworld - Jabroni Mike","2024-01-26"
"jDbUPM8B6x4","Amnesia: The Dank Descent","2015-09-19"
"mnXygsM-hQ4","Amnesia: The Dank Descent","2015-09-19"
"nnLifaVP6xI","Amnesia: The Dark Descent","2015-09-16"
"UMR3ZOSULvE","Amnesia: The Dark Descent","2015-09-15"
"1E2R_smOSyA","Amy Has a Great Time :) - Jabroni-Chan Reads: Wattpad Sonic Fanfics","2021-11-20"
"svRW713eGnw","Amy's Bizarre Adventure - Sims 4 (Part 5)","2023-01-12"
"xky-tUbJ7o4","An Ape-Filled Night - NES and SNES Virtual Console - Jabroni Mike","2023-09-09"
"lfpgl7FRMzo","An Enlightened Discourse on the Merits and Pitfalls of Randian Objectivism","2017-03-09"
"vk7FfM1Ayis","An Undeniable Charm - Sonic Heroes (Finale!)","2020-09-05"
"QLGYYoaOX7U","Analog Horror Dinos - Jurassic Park Tapes + Local 58 + Vita Carnis + Gemini Home Entertainment","2023-12-11"
"3MfFOGEG1fo","Anatomy of a Fall Man - Fall Guys","2020-09-28"
"hLUNCKseNNY","Animal Crossing  - 8/27/17 - Jabroni Mike: Full Streams","2017-08-28"
"iqD6Gvuwv8w","Animal Crossing April Fool's - 4/1/17 - Jabroni Mike: Full Streams","2017-04-01"
"FzxuUXGbrwA","Animal Crossing Bug-Off - 6/7/17 - Jabroni Mike: Full Streams","2017-06-29"
"DIf06thMni4","Animal Crossing Bug-Off - 7/15/17 - Jabroni Mike: Full Streams","2017-07-15"
"U35HPHQpdBA","Animal Crossing Festivale 2/27/17 - Jabroni Mike: Full Streams","2017-02-27"
"G4lphEj3ax8","Animals Against Shorts - Animal Crossing: New Horizons","2020-06-02"
"ORkOk17BfFQ","Apocalypse Beach Party - Death Stranding","2020-02-04"
"D1e06WLLkPM","Arctic Eggs is the Best Cooking Game","2024-05-30"
"HtNZeIIKJqc","Are You Angrier Than a Jabroni? - Gameshow Games","2024-11-05"
"eW7Sfc-Wjb4","Are You Ready to Humble!? - Super Smash Bros. Ultimate","2020-12-06"
"OgfVMGt5JtE","Are You Smarter than a Jabroni? - Wiki Arena","2022-03-29"
"V7D5XP8PA30","Are You Smarter Than Mike? - Game Show Night!","2022-09-04"
"B0aX7x-8WmM","ARK Ep1: Founding Fucks","2015-07-31"
"2po889-kTsI","ARK Extinction - 2/28/18 - Jabroni Mike Full Streams","2019-02-28"
"O7sHLwtTey0","ARK SOTF - Jabroni Mike: Full Streams","2017-01-22"
"rk2Sk77KaYM","ARK w RevScarecrow! - 4/24/17 - Jabroni Mike: Full Streams","2017-04-24"
"I1GBV40x2Pk","ARK: Aberration - Map Exploration and Reaper Queen Fails - Jabroni Mike: Full Streams","2017-12-22"
"he6tiu4IPZM","ARK: Aberration - Reaper Queen Tame and Rockwell Boss - Jabroni Mike Full Streams","2018-01-19"
"v67R1X4irC4","ARK: Aberration Expansion - Jabroni Mike: Full Streams","2017-12-16"
"5rixjMifYVg","ARK: Disappointment Evolved - 7/13/17 - Jabroni Mike: Full Streams","2017-07-13"
"fntO3OplNss","ARK: Spoops Evolved- Broodmother Summon","2015-11-04"
"SiY0QOGPd8U","ARK: Spoops Evolved- Broodmother Summon","2015-11-04"
"ErwUnL43Oek","ARK: Survival Evolved - 10/13/17 - Jabroni Mike: Full Streams","2017-10-17"
"Ep4Ef9Hn7f8","ARK: Survival Evolved - 9/18/27 - Jabroni Mike: Full Streams","2017-09-20"
"39E9aOS8xOw","ARK: Survival Evolved - 9/5/17 - Jabroni Mike: Full Streams","2017-09-07"
"kK_46CN4DiU","ARK: Survival Evolved - Jabroni Mike: Full Streams","2017-03-01"
"TePUdfnUVNE","ARK: Survival Evolved - Ragnarok Map - 8/19/17 - Jabroni Mike: Full Streams","2017-08-21"
"iTYXRSqfRSE","ARK: Survival Evolved New Update - 5/30/27 - Jabroni Mike: Full Streams","2017-05-30"
"jylnl97Pm30","ARK: Survival Evolved WE GOING TO FCKIN WAR SON","2015-08-02"
"QF2VdfoGtmo","ARK: Survival Evolved WE GOING TO FCKIN WAR SON","2015-08-02"
"-k-l00EAE_g","ARK: Survival Evolved","2015-07-07"
"3Ma4vbLejEo","ARK: Survival Evolved","2015-07-24"
"5VApfA_TlIg","ARK: Survival Evolved","2015-07-07"
"9UHuhh4r_GY","ARK: Survival Evolved","2015-06-24"
"cIC5fLMfJkE","ARK: Survival Evolved","2015-07-24"
"d8jPdyUeRTc","ARK: Survival Evolved","2015-07-07"
"empL2L99S8I","ARK: Survival Evolved","2015-06-18"
"kglyddHGMZk","ARK: Survival Evolved","2015-06-20"
"kN-2onxC4r0","ARK: Survival Evolved","2015-06-08"
"kqeH2fF5bpE","ARK: Survival Evolved","2015-07-07"
"l_Lf3b9KFcU","ARK: Survival Evolved","2015-07-07"
"nXDk9jM8PFs","ARK: Survival Evolved","2015-06-24"
"VWwtqPA0Fvc","ARK: Survival Evolved","2015-06-18"
"VzZdx7uC7zU","ARK: Survival Evolved","2015-06-08"
"Y8WNXtwGc1M","ARK: Survival Evolved","2015-06-30"
"T2wHWQlc8rw","ARK: Tek Cave + Ascension OVERSEER KILL! - Jabroni Mike: Full Streams","2017-12-09"
"nhyLoLN1F8U","Artistic Genious: SUCHArt! -Jabroni Mike","2022-10-19"
"GIChm2K31x8","AW HELL NAH DEM GOOS BE GUSSIN ðŸ’€ - Geoguessr + Wonders of Street View - Jabroni Mike","2023-10-04"
"DojIvyIPzCY","Axiom Verge","2016-07-07"
"fJbT5Rrn8No","Baba is You- Jabroni Mike Full Streams","2019-03-22"
"Wi2EKRgs7dw","Baby Blues - Resident Evil Village","2021-06-17"
"rLmYWm5lNU0","Back in the Basement, One Last Time - The Binding of Isaac: Repentance","2021-04-01"
"wzHj3mAIir4","Back to Japan Again! - Yakuza Kiwami","2021-08-04"
"UDJm8yRu-Ok","Backtracking Bonanza - Paper Mario: The Thousand Year Door","2020-12-23"
"1Ainny_z7EY","bad rats Part 2","2015-03-17"
"IvxATP0E_V4","BadLandsChugs Marbles - Marbles on Stream Giveaway","2022-12-20"
"6_xXmtcym6E","Bald in the Bathroom - Meattubing + Geoguessr","2022-05-16"
"JnV3onC-1Yw","Baldo's Gape - Baldur's Gate 3 w/ @RevScarecrow, @Limealicious and @hackerling - Jabroni Mike","2023-08-15"
"ATV40ti7ITg","Ball Guys - Fall Guys: Ultimate Knockout","2020-08-12"
"w0l3MDNSIXc","Banished to the Weed Dimension - GeoGuessr","2022-06-29"
"lk7fqPzrJc4","Barbie and Her Sisters Puppy Rescue - Jabroni Mike: Full Streams","2017-01-22"
"pddDyqXEZ4o","Basement Dwelling Adventure - The Binding of Isaac: Repentance","2021-07-09"
"2dy09QseXTc","Basement Noises - Isaac Afterbirth+","2020-03-07"
"XFd-wEPNkYg","Bass Pro Shop Pyramid in Minecraft - Splatoon 3 Splatfest + Minecraft Bounce SMP","2022-11-15"
"7Ejejs4kW4M","Bastion - 2 / 2","2015-02-28"
"B-jtjYZgBtM","Bayonetta - Part 1 - Jabroni Mike Full Streams","2018-04-13"
"e5oBr1jbztA","Bayonetta - Part 2 Finale - Jabroni Mike Full Streams","2018-04-20"
"BCN7nywYhI0","Bayonetta 2 - Part 1 - Jabroni Mike Full Streams","2018-05-18"
"3FJQNtiItn8","Bayonetta 2 - Part 2: Finale! - Jabroni Mike Full Streams","2018-05-23"
"fQ0kwSPw8i8","Becoming a Cerebral Streamer - Guessr Games","2024-07-31"
"rCXTpjqhwwE","Becoming Hard Men in Hard Time III","2024-11-07"
"hM5RmTIx-kY","Bee Movie Crossover - Animal Crossing: New Horizons","2020-04-20"
"U_3lWbknmes","Best Men - Pokemon Violet (Part 3) Jabroni Mike","2022-12-07"
"nITIifjXIiI","Betrayed by the Foot - The Legend of Zelda: Wind Waker","2021-06-16"
"qpygj9YauzQ","Better Late than Never - Yakuza Kiwami","2021-10-09"
"xMGLcUV2Xis","Biblically Accurate Saac - The Binding of Isaac: Repentance","2021-07-19"
"mrs1Az7xkms","Big Guys Rancher - Ultra Kaiju Monster Rancher (Part 2) + The Angler","2022-11-14"
"WLzaDJsycrU","Bigfoot with Vidyabum (AFSP Charity Stream) - Jabroni Mike: Full Streams","2017-10-24"
"v3W_ilSWwRA","Binaural Beats To Become A Jabroni Mike Girl","2023-02-01"
"PATrpW9yG4s","Binding of Isaac Afterbirf  (Eden Runs 2)","2016-06-02"
"oeYVg8TP7Qw","Binding of Isaac Afterbirf  (Eden Runs?)","2016-06-02"
"lFN1xGaaJiQ","Binding of Isaac Forgotten DLC + Dead Cells Baguette Update! - 05/09/18 - Jabroni Mike Full Streams","2018-05-10"
"1Hr-SePLsqY","Binding Of Isaac With Mods! - Fiend Folio + More","2022-08-26"
"-UsHgv5XivQ","Binding of Isaac/ ARK: Survival Evolved","2015-06-10"
"9xTknxrv9co","Binding of Isaac: Jabroni Drift","2022-10-18"
"ex3V5Fh05xw","Binding of Isaac: Rebirth","2015-06-08"
"gzDETEoaOFA","Binding of Isaac: Rebirth","2015-06-08"
"lj7R4xriNu0","Binding of Isaac: Rebirth","2015-05-13"
"QlYCElaJDuQ","Binding of Isaac: Rebirth","2015-05-17"
"S32HCjR5KMU","Binding of Isaac: Rebirth","2015-05-14"
"tuXRFlHmb9Q","Binding of Isaac: Rebirth","2015-05-31"
"ITIzYQIQqaI","Binding of Isaac: Rebirth/ Nuclear Throne","2015-05-14"
"9vhpt6MdMH4","Binding of Twitch Chat - The Binding of Isaac: Repentance","2021-05-18"
"Bhlvcn7J7NQ","Binging with Bugs - YouTube Trash React Night","2024-11-20"
"JLN7WTG9-NY","BioShlock Part 2 - Jabroni Mike: Full Streams","2017-03-31"
"n67pEY-mH-Q","Bizarre House Listings with Fredrik Knudsen","2024-08-24"
"xbOa9f350h4","Black Shadows","2016-08-05"
"ZMjScRHxxWE","Blast Corps: Rare's Only Good Game","2024-08-21"
"YR-IJJz8NbY","Blasting The Devil's Butt - ANTONBLAST FINALE","2024-12-12"
"F5JD3pWVUJ4","Blonde Twink SLAMMED by Buff Gerudo Dad.avi - 3/29/17 - Jabroni Mike: Full Streams","2017-03-29"
"dbr2seXw7es","Boat Milk Memories - The Legend of Zelda: Wind Waker","2021-06-10"
"OegAO4du_kM","Boatmurdered - A Reading (w/Fredrik Knudsen!)","2021-08-29"
"WrqditzgeLs","Boatmurdered - A Reading PART 2! (w/Fredrik Knudsen)","2021-09-06"
"z2yXN6NjkpI","BOGO Chili Dogs Forever - Sonic Adventure DX: Directors Cut","2020-01-18"
"LYhraHcsYQU","BoI Antibirth 1/29/17 - Jabroni Mike: Full Streams","2017-01-28"
"3wDKWGDklxc","Bonemass Bludgeoning - Valheim (w/ RevScarecrow and Limes!)","2021-04-15"
"cYw3O_-1hx8","Boomer Caveman Virtual Console Night - Jabroni Mike","2023-06-19"
"mSSI7djjHoE","Bootleg & Poop ROMS - 6/9/17 - Jabroni Mike: Full Streams","2017-06-12"
"wiH76waX7IE","Bootleg Halloween Costume Exploration! (w/Fredrik Knudsen!)","2021-10-19"
"boWYcVYqF-Q","Bootlegs Part 1","2015-05-13"
"KEI7jo5wC7w","Bootlegs Part 2","2015-05-13"
"8g-PnzBxHhg","Bosch's ""The Garden of Earthly Delights"" w/ Fred Knudsen! (part 2 finale!)","2019-08-30"
"bI4_LEEs4TQ","Bosch's ""The Garden of Earthly Delights"" w/ Fredrik Knudsen!","2019-08-23"
"ojeyqqL9W2w","Bottom Sounds Generator - WHO ASKED??? + Suika Game - Jabroni Mike","2023-11-06"
"_U7xcA52Q8E","Bouncing in Jschlatt's Minecraft Server - SDMP","2024-08-05"
"C6SGeva3eDQ","Bowser's Yearly Exam - Mario and Luigi: Bowser's Inside Story","2022-05-04"
"BH3033vEHJQ","Boy... -  YouTube Night w/RevScarecrow + The Looker!","2022-07-14"
"s63X1mj7GEc","Boyfights: Robot Edition - Sonic Adventure DX: Directors Cut","2020-01-25"
"iUU3dXZMpks","Break the Walls DOWN! - Teardown","2021-12-04"
"O0YsIHe1Lhw","Bring Your Kid To Work Day - Death Stranding","2019-11-20"
"ITkfov5tKfI","British Geezer Jabroni Mike - Thank Goodness You're Here!","2024-09-05"
"dRtXYPs_xAE","Broadcats Gaming LLC","2016-02-02"
"BZ6C0GIK5o8","Broadcats Radio Hour","2016-03-07"
"9KTAj7k68NA","Brownest Day of the Year - Mobile Ad Mayhem - Jabroni Mike","2024-02-12"
"GET0RhGQoOw","Brush Main on Launch Day - Splatoon 3 (PART 2)","2022-09-10"
"JV2RyElCGFo","Bug Trafficking - Animal Crossing: New Horizons","2020-05-07"
"2kkIpNrB-_U","Building An Island Empire - Animal Crossing: New Horizons","2020-04-02"
"ImWhubdlQLY","Bumbling Bumbo - The Binding of Isaac: Repentance","2021-04-02"
"qSmP2CVbYyk","Bun(house)Time - Bunhouse","2021-10-20"
"ZlELoLOpJMc","Bunger Wars - Hyrule Warriors: Age of Calamity","2020-11-22"
"OCbXP5ywq74","Bungle in the Dungo - AI Dungeon 2","2020-08-15"
"sPEdnFex1N8","Bungle in the Jungle - Terraria w/RevScarecrow!","2020-05-15"
"YGXDv6SYj7A","Bunny Hunting - Doom Eternal (Finale)","2020-04-15"
"IvFlZB_TOug","Bustin' Makes Luigi Feel-a Good! - Luigi's Mansion Dark Moon","2019-08-21"
"LjUHGMhknvs","But, Doc... - Monster Rancher 2","2022-02-11"
"oINrG-lPYF0","Buy Low, Sell High - isaac Afterbirth+","2021-01-30"
"YrdvjQ-HbXw","caastuN fo gnifreN ehT - The Binding of Isaac: Repentance","2021-11-15"
"ZkqoHLp88aU","Caddyjack - Mario Golf: Super Rush","2021-06-29"
"y63ZICriEeI","Cadence of Hyrule- Part 1 - Jabroni Mike Full Streams","2019-06-15"
"lbwMIDfnN58","Cadence of Hyrule- Part 2 Finale! - Jabroni Mike Full Streams","2019-06-20"
"5KDDfwOHFLU","Camp Ugly Children - Psychonauts","2021-12-29"
"IZhdtm2fx00","Can Friendship Survive Minecraft Mods?-08/05/19","2019-08-06"
"eA1ZZu5OzJw","Capturing Satan - Pokemon: Brilliant Diamond","2021-12-22"
"5kjd_Fo6xGc","Care For A Free Sample of Crab Milk? - No Man's Sky Beyond","2019-08-15"
"TdX-557o9yU","Carnado 6: Return of The Curse of The Carnado - Sonic '06","2019-08-29"
"_vvNvcrF9Sw","Castlevania Comment of the Night - Castlevania SotN (PART 1)","2022-08-10"
"SqN4nZ9y4Lw","Casual Filtered - Guess Games + Lies of P - Jabroni Mike","2023-09-24"
"WxC2jh03Ahk","Catalina and Chill with Kwite","2024-04-21"
"Jcvqs4c_nV0","Catboy Mike - Suika Game - Jabroni Mike","2023-12-21"
"GQlfZjQVWz4","Catboy Mike Plays The Dead Space Remake","2024-11-02"
"um2lenVTOdQ","Catching PokeMen for Men's Health - Movember Charity Stream!","2019-11-24"
"sHxsOPIucP0","Catching Up On Chat's ""Interesting"" Art","2024-09-25"
"Qu5k-NqEw3c","Catching Up With Skibidi Toilet + Dracula Flow + Funny Pets - Jabroni Mike","2023-10-09"
"xi6AggnMNxM","Cave and Ball Torture - Spelunky 2","2021-09-27"
"MFbe-jgjMYU","Caveman Smash or Pass - Jabroni Mike","2023-02-17"
"fCMALHo4KmM","Cavemen Vs Goblins - The Forest w/RevScarecrow!","2020-07-21"
"DZYEyeZV5tI","Cephalpod Wrestling - Animal Crossing: New Horizons","2020-05-12"
"s35_OkhZCXs","Chained Together with Jameskii, Revscarecrow and ExpansionGames","2024-07-01"
"FJrXqBGSZA8","Changes on the Horizon - Mario Kart 8 Deluxe","2021-03-12"
"WBFAVfD6zcM","Chao Garden Returns! - Mike Plays Bobo Bay and Gestalt","2024-07-26"
"aXZggxlN4kU","Chaotic Lethal Company w/ OverEzEggs, Tobs, Rev, Limes & More! - Jabroni Mike","2023-12-16"
"l11l_wpI8kI","Chaotix & The Case of the Super Tuber - Sonic Heroes","2020-08-24"
"JPINE7QIDD4","Charity Grab Bag Gaming! - Crab Game + Goose Goose Duck + Gartic Phone - Jabroni Mike","2023-08-06"
"u2ZnQ6fHGLc","Charity Tabletop Sim w/ @vinesauce, @RevScarecrow, @gearomatic and @FredrikKnudsen - Jabroni Mike","2023-08-05"
"t7-3Y1s0B48","Chat Forced Me to Play Garn 47","2024-05-24"
"cB3rctYGVEE","Chat Made me Become a Drag Queen","2024-06-23"
"C2hfbm9Rwo8","Chat Made Me Play Cruelty Squad","2024-07-25"
"3Q7Mvv_rkhQ","Chat Made Their Own Content Farm Videos Again! - The Fingies 2024","2024-08-30"
"EVJXgoPbm8Y","Chat Pranks God - Chat Writes a Sonic Fanfic","2022-06-07"
"qqrDNzX3-mQ","Chat Sent Actually Funny Videos This Time - Jabroni Mike YLYL","2023-11-04"
"zCV16c4q7vE","Chat Sent Me EVEN MORE YouTube Poops","2024-10-13"
"kktg7oddO8c","Chat Sent Me The Funniest YouTube Poops","2024-08-23"
"a9IGZb7W4xs","Chat Sent Me Their FUNNIEST YouTube Poops","2024-11-10"
"UslvJ1n_jQc","Chat Spends $250 on Wish Garbage Shopping - Jabroni Mike","2024-01-16"
"duOVKq2-VZU","Chat's Favorite Scene - Paper Mario: The Thousand Year Door","2020-12-03"
"x-wkCxbQ85s","Chat's Takeover - WHO ASKED??? + Kukoro - Jabroni Mike","2023-09-04"
"1L82WXVFi0w","Chat, we need to talk... - Guilty Gear Strive + Lethal Company - Jabroni Mike and Friends!","2023-11-25"
"X9P8HaFJon0","Chat-Crafted Mayhem and A Clown...Unless? - Mario Maker 2","2019-08-12"
"HEtZD7fHDqg","Chat-Submitted Cringe Slop YLYL","2024-03-26"
"itcpKf2cRuY","Checking Out Splatoon 3 Story Mode (PART 4) + Spamton Sweepstakes","2022-09-20"
"9M6MyrZrVz4","Chess Smackdown - Mike Vs. Fred (w/ Fredrik Knudsen!)","2020-12-04"
"Wg7RWL9osRY","Cheugin' and Chillin' - Animal Crossing: New Horizons","2021-11-12"
"7sr0guOta-g","Chicken Vs Egg Splatfest! - Splatoon 2","2020-08-22"
"buwCrtqKb-Q","Chimera Clobbering Simulator - Mother 3","2020-09-29"
"lW-6SQG_dhA","Chinatown Bootleg Hunting w/@Greatzott - Jabroni Mike IRL","2023-10-11"
"Oh9sHJgf1t4","Choice Chamber - Jabroni Mike: Full Streams","2016-12-08"
"AGn6KGsbJDQ","Chris Pratt Is: Isaac Binding - The Binding of Isaac: Repentance","2021-11-04"
"IaZ2JXc9g6s","Circus of Sorrow - Monster Rancher 2","2022-03-08"
"_K-0nY_haa0","Clandestine Home Designer - Animal Crossing: New Horizons","2021-12-01"
"lhjzvYrJlbA","Clash of Clans - Jabroni Mike","2023-02-28"
"qfFYJ_bw6WI","Clash of Men - Jabroni Mike","2023-04-23"
"34uGeDbAwsY","Clash Royale - Jabroni Mike","2023-02-28"
"V5BxkCGaBt4","Classroom Antics - Sporcle","2022-04-14"
"zsA3jfaLD5o","Cleaning Up Biohazards - Resident Evil 6 (w/Limealicious!)","2021-11-12"
"Xckmc7-yseI","Clear Definable Goals - Terraria w/RevScarecrow!","2020-05-04"
"0k7qSV0eFRM","Cloaca Bashing Simulator - Monster Hunter Rise","2022-01-20"
"JFheekiOnCA","Clownin' Around - Animal Crossing: New Horizons","2020-10-08"
"vFqnEk7Isfw","Clownjobs (Dropsy)","2016-05-26"
"wkLt4lPQxr0","Clumsy Streamer Fighting - Toribash (w/RevScarecrow!)","2021-11-23"
"nFb6zMG0Dmg","Clunched - Jabroni-Chan Reads: Wattpad Sonic Fanfics","2021-02-20"
"12PM_ArpoyY","Co-Op Crusade - The Binding of Isaac: Repentance (w/RevScarecrow!)","2021-06-22"
"zTwEAMP5deM","Come On! Hurry Up! - Resident Evil 5 (w/Limes!)","2021-04-29"
"lkeUWTYWtLA","Come Play With Us, Gooigi - Luigi's Mansion 3","2019-11-05"
"KcNEExevxVk","Commence the Jigglin' - Shantae and the Seven Sirens (Part 2)","2020-06-14"
"I1gSjF6aizk","Commie Mommie Dating Sim - Destroy All Humans 2: Reprobed (PART 2 FINALE)","2022-09-08"
"hZq3ztvkFZo","Community Splatfest #3 and 5-Year Streamiversary! - Splatoon 2","2020-02-18"
"-YzWCRSN7cs","Community Splatfest #4 - Splatoon 2","2020-05-09"
"AQHGC5GBTkA","Community Splatfest: Zooted Eggman Vs Unhinged Sonic + Immortals Fenix Rising","2021-03-28"
"fz5J5qSe1bw","Companions Update! - No Man's Sky","2021-02-26"
"NunLioJCc8s","Complete and Utter Garbage","2015-05-17"
"sRpVRoXYEXs","Complete and Utter Garbage","2015-05-17"
"63CGnfV9dtE","Conan Exiles - 05/11/18 - Jabroni Mike Fullstreams","2018-05-12"
"MUNxtMP9MDc","Conan: Exiles - 05/18/18 - Jabroni Mike Full Streams","2018-05-19"
"7u8zvS5qJOo","Constipated and Scuffed You Laugh You Lose","2024-04-08"
"s4ZskBUHeas","Cookie Time! - Wiki Arena + GeoGuessr!","2022-04-29"
"3HEsGScCqT4","Coomhead and Maldman - Cuphead: The Delicious Last Course + Isaac","2022-07-13"
"D_nMFMM3woA","Cope & Seething in Las Vegas DAY 1 - Jabroni Mike IRL","2023-10-18"
"Tioy_Fk8Y_k","Cope & Seething in Las Vegas DAY 2 - Jabroni Mike IRL","2023-10-18"
"rwH1VpOEjWI","Cope & Seething in Las Vegas DAY 3 - Jabroni Mike IRL","2023-10-19"
"CwLNT4b2sLY","Counter-Strike: Global Offensive- Join in!","2015-06-08"
"ic8VuhfWhWg","Counter-Strike: Global Offensive- Join in!","2015-05-23"
"Ndfhvpdn_q8","Cramming The Banshee - Halo CE Master Chief Collection (W/ CommanderStatik!)","2020-03-12"
"rE1QSK9-BwA","Cream-Filled Gingerbread House - Star Wars Holiday Special - Jabroni Mike","2023-12-23"
"73AP8-vZqAI","Create Your Own Pizza (Tower) - Jabroni Mike","2023-07-01"
"iixaoP5LSlo","Creating the Stupidest Mutant Dogs in Wobbledogs","2024-05-02"
"akbXb3Md_ck","Creating The Ultimate Freak In Once Human","2024-10-11"
"OLZ_hwM78co","Cribs: Isla Chuga Edition - Animal Crossing: New Horizons","2021-11-29"
"yNdz8zfB-FM","Crime-ophobia - The Break-in w/ @FredrikKnudsen, @RevScarecrow, @hackerling and @GEEGA","2023-07-18"
"68jV2AMLYCE","Cringing At Your TERRIBLE TikToks","2024-11-15"
"cTZwSziaW2Q","Crow Country Made Me So Mad","2024-06-06"
"IPYJJjFQ5AE","Cruising in the Google Carby - Geoguessr","2022-03-10"
"jRtdgKLerJ4","Crusty Games Monday - Cruelty Squad and Krypta FM","2024-07-28"
"FGfApO4bm28","Cry Hard 3: Cry Hard with a Vengeance - Isaac Afterbirth+","2019-08-17"
"FXwmLJo-nuE","Crypt of NecroPhiliac","2016-03-07"
"CkeYBiIQWl8","Cryptid Mascot GeoGuessr","2024-04-24"
"0pi-enfa_54","Cryptid Spotted - Valheim (w/RevScarecrow!)","2021-03-16"
"8GWsCauayVo","Crystal Isles - Ark: Survival Evolved w/RevScarecrow!","2020-06-18"
"bx0Et7NKmas","CTRL + ALT + Rev + Mike - YouTube Browsing W/ @RevScarecrow","2023-04-25"
"c4zUb_Cl7lk","Cult Of The Sonic Fandom - Cult Of The Lamb (PART 2)","2022-08-14"
"Luj8Gt-Fbw0","Cult Of The Twitch Streamer - Splatoon 3 Direct Reaction + Cult Of The Lamb (PART 1)","2022-08-11"
"E_7lUB39OLE","Cuphead - Part 1 - Jabroni Mike: Full Streams","2017-10-04"
"ILLnjUgkRfM","Cuphead - Part 2 - Jabroni Mike: Full Streams","2017-10-10"
"JxOBtof20Zs","Cuphead - Part 3 - Jabroni Mike: Full Streams","2017-10-24"
"Qv1T1wEPptg","Cyclops Sightings - GeoGuessr","2022-03-12"
"czjC2d7VV_s","Daddy Chill Time - YouTube W/ Rev + Stumble Guys + Splatoon 3","2022-10-05"
"qRxwSHYXIi4","Dampening Up - Risk of Rain 2","2020-10-16"
"rPUcbC7ePL4","Dandori GOAT - Pikmin 4 FINALE - Jabroni Mike","2023-08-02"
"OLvT4N2fZXs","Darkest Dungeon - Jabroni Mike: Full Streams","2017-11-24"
"HRyQCHOHV5U","Darkest Dungeon Part 1 - Jabroni Mike: Full Streams","2017-09-28"
"OYsD-ngOOeg","David Cage's Beyond: Two Farts","2024-12-21"
"oMhZ3UaUnrU","De-Digitizing Emotes - Face Depixelizer (w/ Fredrik Knudsen!)","2020-07-15"
"AAqpIMzLdjI","Dead Cells & Stardew Valley Part 4 - Jabroni Mike Full Streams","2018-01-30"
"JL8A481qbOg","Dead Cells (ASSASSIN VICTORY!) 2/20/18 - Jabroni Mike Full Streams","2018-02-26"
"E1JV7OeiJg0","Dead Cells - 08/08/18 - Jabroni Mike Full Streams","2018-08-09"
"CEhQ0ZuMYOU","Dead Cells - 08/14/18 - Jabroni Mike Full Streams","2018-08-15"
"Chl6lIWXF2Y","Dead Cells - 09/04/18 - Jabroni Mike Full Streams","2018-09-05"
"EFEaSaC4JLc","Dead Cells - 5/15/17 - Jabroni Mike: Full Streams","2017-05-15"
"_Oo2FYIG5Gc","Dead Cells - 5/16/17 - Jabroni Mike: Full Streams","2017-05-16"
"wRgtdv3mKe8","Dead Cells - 5/24/17 - Jabroni Mike: Full Streams","2017-05-24"
"fvYvcI1DEmk","Dead Cells - 5/29/17 - Jabroni Mike: Full Streams","2017-05-29"
"8tXxPAY-Yu4","Dead Cells - 6/3/17 - Jabroni Mike: Full Streams","2017-06-05"
"sywTz-uFBRE","Dead Cells 1/15/18 - Jabroni Mike Full Streams","2018-01-19"
"ZscaFHm64ec","Dead Cells 1/18/18 - Jabroni Mike Full Streams","2018-01-20"
"4_gyWDD1hZE","Dead Cells 6/27/17 - Jabroni Mike: Full Streams","2017-06-29"
"JeCEv0jac40","Dead Cells: HAND OF THE KING UPDATE! & BoI - Jabroni Mike Full Streams","2018-03-17"
"KMXFElJ24lE","Death Road to Canada - Jabroni Mike: Full Streams","2017-01-13"
"785Q0ThMOLg","Death, Taxes and Cringe YLYL - Jabroni Mike","2023-07-28"
"zUfic0bdV8Q","DeeDeeDee is Megadoodoodoo - Kirby Return to Dreamland (Part 2 Finale) Jabroni Mike","2023-03-04"
"4b6A50_Vsfc","Definitely Yoshi's Island - Retro Game Night","2022-03-12"
"spOKgXSxBlk","Deity Dating Simulator - Hades","2020-04-26"
"X6rdtcJ7bt4","Deltarune - Part 1 - Jabroni Mike Full Streams","2018-11-29"
"j1kDvMHrrMs","Deltarune - Part 2 - Jabroni Mike Full Streams","2018-11-30"
"r__qWyTuIDM","Democracy Manifest - Helldivers 2 w/ Limealicious - Jabroni Mike","2024-02-23"
"P08txxfaLNM","Deranged Mobile Ads To Lose Your Mind To","2024-09-04"
"YngUCVb5GCs","Designing Homes, Isla Chuga Style - Animal Crossing: New Horizons","2021-12-31"
"i6TqTeFBOdk","Desperately Seeking Lizbert - Bugsnax (Finale!)","2020-11-19"
"WBzGbt1sj8Q","Destroying My Throat in The Choicer Voicer","2024-09-16"
"-vBRn3HaiW4","Detective Jabroni Harrasses AI Suspects - Vaudeville FINALE - Jabroni Mike","2023-08-23"
"Gn4UlqcVMfo","Detective Pikachu - Jabroni Mike Full Streams","2018-03-25"
"P6_A39W-25A","Detective Pikachu - Part 3 - Jabroni Mike Full Streams","2018-04-05"
"0uP9nhxOA8M","Detective Pikachu - Part 4 - Jabroni Mike Full Streams","2018-04-12"
"gF2Ie69PdHQ","Detective Pikachu - Part 5 - Jabroni Mike Full Streams","2018-04-24"
"fseQgiZTNJc","Detective Pikachu - Part 6 Finale - Jabroni Mike Full Streams","2018-05-08"
"Jj6r_onxA7k","Detective Pikachu Part 2 - Jabroni Mike Full Streams","2018-03-26"
"t6zl57pbvZQ","Detroit Bad Smell Air - Detroit Become Human (Part 2) Jabroni Mike","2023-02-12"
"fAqcIY6Qv6Q","Detroit Become Stinky (Part 1) - Jabroni Mike","2023-02-10"
"9pKdkLVacLA","Diablo III","2015-09-16"
"hyKqMmjwpnY","Dial-A-Hooker","2015-05-17"
"8dh_6hKdpvk","Did Shadow Cheat on Rouge the Bat with Eggman?!-08/07/19","2019-08-08"
"bwizPgmRt5k","Dies of Pee - Lies of P - Jabroni Mike","2023-09-17"
"S_iWy2EHQFc","Digging Through Your Trash To Find You - Geoguessr + Star Trek Fleet Command","2023-01-25"
"xA1s5_V2YEE","Diggy Diggy Hole - Undermine","2021-01-03"
"sHG_x36eJXw","DINO DMONDAY - Animal Revolt Battle Simulator + Meme Game Monday - Jabroni Mike","2023-09-25"
"ZPxE0-nPawM","DINO DMONDAY 2: Gextinction - Jurassic World Evolution 2 - Jabroni Mike","2023-12-04"
"XVv3kqktErQ","DINO RP: PATH OF TITANS","2023-06-10"
"5Xe3RqgFbBY","Dirk Intense: Health Inspector - GTA RP NoPixel 4.0 - Jabroni Mike","2024-01-30"
"53dvx_0IShY","Discriminating Chugger - Mario and Luigi: Bowser's Inside Story","2022-06-08"
"RZcJw5V86e4","Disgusting TikToks That Rot Your Brain","2024-05-12"
"0DTxJc6te8w","DK Tropical Freeze 4","2016-11-15"
"r1sy5iuMfK8","DK Tropical Freeze FINALE","2016-12-05"
"pUnWuxvKwPA","DK Tropical Freeze Part 1","2016-11-07"
"TrKh4d0jniA","DK Tropical Freeze part like 3 i think whatever","2016-11-15"
"d377whthYss","DK Tropical Freeze *ACTUAL FINALE*","2016-12-28"
"wAyuykg8s2A","DLC Thrussy Destruction - Mario Kart 8 Deluxe (w/ Joel!)","2022-03-23"
"aX_lzEjnX2g","Do NOT Watch These Mobile Ads at 3 AM","2024-11-06"
"KGD0ryXoa_8","Do You Like Bounce SMP? - Jabroni Mike (Part 1)","2022-10-27"
"M58bhIkn8Fo","Does Your Purple Neighbor Suffer From ""Haunted Grill""? 8/8/19","2019-08-09"
"Gb-04Hj2PJk","Doing some Sucking Live on Stream - Suck Up! - Jabroni Mike","2024-01-02"
"_Q5ooKk9Fk4","Dokapon Kingdom: Connect w/@GEEGA and @Limealicious + Absurd Trolley Problems + Earth Reviews","2023-09-30"
"o53E4O-t4VQ","Don't Call Jabroni Mike at 3AM - Roblox","2024-01-15"
"eJpgUUgFP30","Don't Cross The Streams - Luigi's Mansion 3","2019-11-09"
"8V-RArflils","Don't Dream It, Be It - Link's Awakening (finale!)","2019-10-19"
"OYHpFxslwJc","Don't Starve Together Beta","2015-08-22"
"XhOgLFEeLJQ","Don't Starve Together Beta","2015-08-22"
"zBSa85nny-w","DOOM - Part 1 - Jabroni Mike Full Streams","2018-11-13"
"-3iMLVOHKhE","Doom - Part 2 - Jabroni Mike Full Streams","2018-11-21"
"OOu1RqDyXgc","Doom - Part 3 - Jabroni Mike Full Streams","2018-12-11"
"sa98GVtADrw","Doom - Part 4 - Jabroni Mike Full Streams","2018-12-12"
"YX0zbYYNgHw","Doom - Part 5 Finale - Jabroni Mike Full Streams","2018-12-19"
"1hZZIfqh4F0","Double Feature: Joel's Texas Trip and Star Wars Holiday Special","2024-12-27"
"qYnHDRI8eWE","Double Trouble - Hades","2020-11-11"
"BXWYUqECYsc","Doug Walker's Trivia Night Gauntlet","2024-05-08"
"i-0KxULqqL8","Down the Basement Hole - The Binding of Isaac: Repentance (w/ Fredrik Knudsen!)","2021-06-27"
"-eCkjhyBoRw","Down the Irish Kung Fu Rabbit Hole with FredrikKnudsen","2024-03-28"
"WP4wemyeO-c","Down the Rabbit Hole: Eve Online (Director's Comentary) W/Fredrik Knudsen and Ryan Probert","2023-11-02"
"JVMXprVFnho","Down the Tommy Tallarico Rabbit Hole - Unreal Estate w/ Fredrik Knudsen - Jabroni Mike","2024-02-20"
"WzezvbGKpQg","Downwell","2016-07-02"
"d8vAOvJE6h0","Dracula Flow Plays V Rising","2024-05-10"
"2wlJj_ePv4M","Dragonslayer Sonic - Sonic and the Black Knight (Finale!)","2021-07-19"
"WThYPOexYIU","Dread the 'Roids - Metroid Dread","2021-10-17"
"SliAx-ygxas","Dreading the End - Metroid Dread (Finale!)","2021-10-20"
"kSlzgXVkRZo","Dreams - 05/10/19 - Jabroni Mike Full Streams","2019-05-10"
"ghT5zpA9W54","Dreams - 05/28/19 - Jabroni Mike Full Streams","2019-05-29"
"7sGN338mJ5k","Driving Down Bussey Road - Quizzes + GeoGuessr - Jabroni Mike","2023-12-06"
"mEymWMXm1Ns","Dropsy Part 2","2016-06-04"
"nbso3Z85iiM","Drum Stream + P Ranking Pizza Tower (Part 2) - Jabroni Mike","2023-03-05"
"2Jlh7bQbTdQ","Duck Game w/ Bros","2016-07-01"
"Srl09OfnFzQ","Duck Game","2016-06-18"
"Zs1JhWJw31Q","Dungeon And Dargons 6/11/16","2016-06-11"
"ESvNDIoTUM8","Dunkey's Animal Well","2024-05-17"
"y-WbMUvZAHE","E.T. and Shadow the Hedgehog","2015-04-18"
"XiBVt11toKE","Ear-otic Stream - Psychonauts 2","2022-06-07"
"ulhck8YZDSQ","Eating Oatchi to Survive - Pikmin 4 + The Expamse: A Telltale Series - Jabroni Mike","2023-07-29"
"J76UwkTuX6U","Ecco the Dolphin Part 3","2016-05-26"
"22K1B687sDA","Ecco the Dolphin Part1","2016-05-19"
"TDI5bTZIDrE","Ecco the Dolphin Part2","2016-05-19"
"PI0L81cI7yk","Ecco the Dolphin Part4","2016-05-20"
"f3EkwiFXm8Q","Ecco Tides of Time Part2","2016-06-07"
"5V45SKxXhLU","Ecoterrorism And Romance - Final Fantasy 7 Remake","2020-04-11"
"GKM548IEt4Q","Edgy Frenzy - Risk of Rain 2","2022-03-08"
"HsJJkfHlnOU","Edgy the Hedgy's Quest for Finality - Shadow the Hedgehog","2022-04-06"
"7w5oFxy4Ei8","Edgy the Hedgy's Redemption Arc! - Shadow the Hedgehog","2022-04-29"
"YEp4InKXobA","Elder God Type Beat - Terraria w/RevScarecrow!","2020-06-09"
"-MvbARNnDlE","Elevator Goes Up - Exit The Gungeon","2020-03-19"
"lq9PPRQjjDc","Eleven Days to Not Alive - 7 Days to Die (w/RevScarecrow!)","2020-09-22"
"rX_Jqn_La5M","Elite Four is No More - Pokemon: Brilliant Diamond","2021-12-16"
"3kyCaesVcio","End of Pokevangelion - Pokemon Sword","2019-12-07"
"5ce55AbRPsY","End of Septicgelion - Sonic Frontiers Modded (Part 6 FINALE)","2022-11-24"
"OqhKvqMe0NQ","Engineering Success - Satisfactory (w/RevScarecrow!)","2020-09-08"
"fFkmoPuufBY","Enter the Gungeon - 04/28/19 - Jabroni Mike Full Streams","2019-04-30"
"KEz6WGSmNw8","Enter the Gungeon - 05/21/19 - Jabroni Mike Full Streams","2019-05-22"
"H_rxu8_ZKCk","Enter the Gungeon - 05/29/19 - Jabroni Mike Full Streams","2019-05-31"
"jcLI6UUc0Gs","Enter the Gungeon - 06/26/19 - Jabroni Mike Full Streams","2019-06-27"
"Ex3MxSG1mZc","Enter the Gungeon - 07/03/19 - Jabroni Mike Full Streams","2019-07-04"
"qhtCCT3cxgU","Enter the Gungeon - M6000W","2017-02-09"
"QxDvIUfupcs","Enter the Gungeon p1","2016-04-27"
"n_f8SeEfffU","Enter the Gungeon p2","2016-04-27"
"9ric71S8e8s","Enter the Gungeon","2016-04-23"
"AyXFYcprqa8","Enter the Gungeon","2016-05-16"
"HO6zSlJPPtM","Enter the Gungeon","2016-04-23"
"5qUudiL3a1s","Entertaining the Masses - Mario and Luigi: Bowser's Inside Story","2022-06-11"
"EpOnXvIQQk4","Epic Gamer Rage - The Binding of Isaac: Repentance","2022-06-20"
"CGAWgYB2f5Y","Epic Gamer Smash or Pass - Jabroni Mike","2022-10-30"
"uLx_89E2fPs","Escape the Goop - Fall Guys","2020-08-20"
"kNeam3kUKsQ","Ethan's Last Stand - Resident Evil Village","2021-06-24"
"QeOcShS0Ux0","Even More Wish Garbage Shopping! - Jabroni Mike","2024-01-17"
"85LlFX7sEQU","Every Great Dream Begins With a Dreamer - Link's Awakening","2019-09-24"
"Gn1XvKYPcKE","Everybody Hates Chip - Sonic Unleashed","2021-02-04"
"i-WjtJzTeXI","Everybody Loves Matara Kan in That's My Streamer","2024-10-29"
"BegSMfG4Ik0","Everyone is Here! - Mario Kart w/ Fredrik Knudsen, RevScarecrow, and Huggbees!","2022-01-28"
"owKlrYD3g2Y","Everyone Makes it Out Okay - Resident Evil 6 (w/Limealicious!) Finale!","2021-12-03"
"3ru1FD2yqKI","Evil Requires The Sanction Of The VIctim - Untitled Goose Game","2019-09-30"
"BG7RduYzP1I","Extreme Roads USA - 7/4/17 - Jabroni Mike: Full Streams","2017-07-04"
"xOqpJkTeQlw","Extreme Roads USA","2016-07-04"
"qgGOkFFTwRk","Extremely Expensive Unreal Estate With Fredrik Knudsen","2024-12-04"
"M5FGa7Fu7U8","F N A F : Sister Fister - Jabroni Mike: Full Streams","2017-01-25"
"eG2Q-fQFLaA","Factorio with Revscarecrow - Jabroni Mike: Full Streams","2016-11-29"
"uFD-ia_z2eo","Failing the Internship - New Pokemon Snap","2021-05-06"
"i0eGFJ6XrvA","Fall Guys in 2022? (eyeroll emoji) - Fall Guys","2022-07-10"
"5jG31KmKuYQ","Fall Men For Men's Health - Fall Guys (w/ RevScarecrow!)","2020-11-10"
"w2Iu0wNbLGg","Fallectric Boogaloo - Fall Guys","2020-10-09"
"ZVnbheM0Nf4","Falling With(out) Style - Fall Guys","2020-09-07"
"YKU1Kn63qCc","Fallout 4","2016-04-23"
"z_JnzQ9EfQw","Fallout 4","2016-04-23"
"tK019oGssQg","Fallout 76 B.E.T.A. - Part 2 - Jabroni Mike Full Streams","2018-11-06"
"cFspAf65wzU","Fallout 76 B.E.T.A. w. RevScarecrow! - Part 1 - Jabroni Mike Full Streams","2018-11-05"
"fHTCuClYGbU","Fallout: New Vegas","2015-09-11"
"g3bjgv45CLw","Fallout: New Vegas","2015-08-22"
"i06iBe3ov5E","Fallout: New Vegas","2015-08-31"
"lTMwEp22_Ug","Fallout: New Vegas","2015-08-22"
"m7hDh69-ZTk","Fallout: New Vegas","2015-09-11"
"sVjq51gX7Pc","Fallout: New Vegas","2015-08-31"
"9jOW7KgvRbQ","Far Cry 5 - Jabroni Mike Full Streams","2018-03-30"
"puzbsGkNs80","Far Cry 5 - Part 2 - Jabroni Mike Fullstreams","2018-04-06"
"E9eiMmTESfY","Far Cry 5 - Part 3 - Jabroni Mike Full Streams","2018-04-10"
"E5Kf3TzSP14","Far Cry 5 - Part 4 - Jabroni Mike Full Streams","2018-04-16"
"YTWNAjtFa60","Far Cry 5 - Part 5 Finale - Jabroni Mike Full Streams","2018-04-18"
"3yv8OCRbP3k","Farmers Only - Stardew Valley Co-Op (w/ RevScarecrow!)","2021-01-12"
"aioFPwJnSNE","FASTFEST 2016 (Sonic the Hedgehog)","2016-07-07"
"5ouA_Pn7FpA","Fat Cork GUESSR! - Geoguessr With Twitch Chat","2022-09-22"
"QdR8q6KRncE","Fat Sands Humbles You ASMR - Undertale","2020-11-02"
"4yE-FCEPVuk","Fat Stinky YouTube Content - Jabroni Mike","2023-03-21"
"ZJc4SmJcEjY","Fatal Emblem: Mark Of The Clowns - Smash Bros. Ultimate","2020-02-19"
"9WweyTmjHhg","Fatal Falls Update - Dead Cells","2021-01-27"
"mxjzbYeVUcU","Fate/Stay Smash or Pass? - Jabroni Mike","2022-12-01"
"maqgLJrjnms","Father's Day Movember Extravaganza - Dad Quest + Octodad","2020-06-22"
"hYDrYIoNWVk","Fatty Bear's Birthday Surprise","2016-06-28"
"DSpAvokcdxU","Fecal Company - Lethal Company w/ Vargskelethor, SimpleFlips and Alfhilde - Jabroni Mike","2023-11-28"
"TLMsaJpZt2Q","Fecal Themed Roblox Games - Jabroni Mike","2024-03-03"
"UfaonYf_ubI","Feel The Rawk - Paper Mario: The Thousand Year Door","2020-12-15"
"PotjQtrhA68","Fella Adventure XD - Monster Rancher 2","2022-01-21"
"LMd0DYzibL8","Festive Fumbling - Fall Guys Season 3","2020-12-16"
"9CeuoY2ujvQ","Field Trip to the Ramen Museum - GeoGuessr","2022-07-28"
"AeNlxiOf6WY","Fifty Shades of Gruntilda - Banjo Kazooie","2020-06-02"
"RN8azUjYUv0","Fight, Fight, Kiss, Kiss - It Takes Two (w/RevScarecrow!) + Binding of Isaac: Repentance","2021-04-13"
"4kUJCdocug0","Fightin' Dogs and Cops - Earthbound","2019-12-15"
"Tza_BRVcEec","Fighting Game Smash or Pass + Call of the Wild: The Angler - Jabroni Mike","2022-09-03"
"USAcXnN0GHE","Fighting Your True Self - Splatoon 2 (Octo Expansion)","2020-06-05"
"5xIFcXjhqjo","Filling Up Loose Ends - Cocoon FINALE + The Hex FINALE - Jabroni Mike","2023-10-08"
"mUgJaw7Bmlo","Film Theory Rotted My Brain","2024-09-10"
"bjd7AbHEGxs","Final Fantasy 6","2016-03-18"
"GYQLvI1KSYM","Final Fantasy 6","2016-03-18"
"z-BV8VFJPuw","Finding Bobby - Paper Mario and the Origami King","2020-08-01"
"tjmkJM4ocn4","Finger Family Algo Slop RETURNS","2024-12-22"
"dbSHmyXmCyY","Finishing the Fight - Paper Mario: The Thousand Year Door","2021-01-25"
"fYX23XsHQiI","First Saac of the New Year - The Binding of Isaac: Repentance","2022-01-17"
"FZKQ1ymiGds","Fishing Jokes DLC - Animal Crossing: New Horizons","2020-05-10"
"Z5k8bUCtBsw","Five Dollar Footlong - Spyro 2: Ripto's Rage","2022-02-16"
"cqWvL0nc2pM","Five Nights at Freddy's/FTL","2015-06-20"
"JkUaPdd3EVo","Flat Mario Moons the Moon - Paper Mario: The Thousand Year Door","2021-01-14"
"yyK5ky3fpeE","FML","2016-01-16"
"nbeJS5GWNtY","FNAF but with Vtubers - Meet Your Oshi + Prison City + Mario Kart 8 w/ PorcelainMaid - Jabroni Mike","2023-11-13"
"PGNtBRY51ZY","Forest Follies - The Forest w/RevScarecrow!","2020-06-23"
"uW-NWQsIN0Y","Forsaken Fun! - Blasphemous","2021-08-20"
"FmjlMozWR7E","Fortnite feat. RevScarecrow - Jabroni Mike Full Streams","2019-03-05"
"z1m4hIuMdUY","Forward and Saac - The Binding of Isaac: Repentance","2021-11-30"
"D5Ch6OKS_Fg","Fourside Corporate Espionage - Earthbound","2020-03-05"
"lqYwbyz3NX4","Fourth of July Spectacular - Community Splatfest + Extreme Roads USA","2020-07-05"
"p07m4oOEXto","Fredrik Knudsen Approved YLYL - Jabroni Mike","2023-09-16"
"uPdRUB0wG8I","Friday Night 'Saac Fondle","2016-03-04"
"w91xFR-3mh4","Friday the 13th - 10/13/17 - Jabroni Mike: Full Streams","2017-10-17"
"K0Rqhak3WnE","Frozen Smashing - Pokemon Sword The Crown Tundra DLC + Super Smash Bros. Ultimate","2020-10-23"
"FxKdfgS8rb4","FTL - 1 / 2","2015-03-16"
"OYCvQ2gEMEQ","FTL - 1 / 2","2015-03-16"
"POMBIMQvyOM","FTL - 1 / 2","2015-03-04"
"KQBwg-UoMhw","FTL - 1 / 3","2015-03-09"
"7ErMZ2WhAI4","FTL - 2 / 2","2015-03-04"
"gs3sIQ0RtL0","FTL - 2 / 2","2015-03-16"
"ABFN5OoPSQM","FTL - 2 / 3","2015-03-09"
"jpPTfDFqtbY","FTL - 3 / 3","2015-03-09"
"Aa4H1dSZw_M","FTL","2016-08-13"
"KINrAjZgSvI","FTL","2015-06-03"
"1qGkwGi7u7c","FTL: Advanced Edition - Part 1 - Jabroni Mike Full Streams","2019-02-07"
"AM-HxkIOQYY","Fun With Hatsune Mike-u + FAITH - Jabroni Mike","2022-11-03"
"2aYWcua-4LU","Fun With Hatsune Miku - Family Fued + Project Diva Megamix","2022-09-23"
"bjhgcuXYSi4","Funky Spelunky - Spelunky 2","2021-08-30"
"mNuY4M6B5Mc","Funny Videos to Make Ape Noises to - YLYL","2024-07-11"
"NgzurHyJ8hQ","Furry Fall Guys - Party Animals w/@Limealicious, @SimpleFlips and @RevScarecrow + Roblox","2023-09-21"
"0scTEAXOp-s","Furry Mario Vs Fury Bowser - Super Mario 3D World + Bowser's Fury","2021-03-08"
"AoVHtfo5ONY","Furry Vengeance - Sonic Unleashed","2021-01-31"
"Y70ouRlhiEk","Galactic Manifest Destiny - Stellaris (w/ Fred Knudsen!)","2020-05-20"
"QIu8MUskYfM","Galactic Shitman","2016-03-18"
"9mzM53eCPfc","Game Freak Took the Kids - Pokemon: Brilliant Diamond","2021-11-25"
"R6R-cDSA-hg","Game Show Host Jabroni Mike - WHO ASKED??? + Streamer's Court","2023-08-14"
"OW1wajfRMNc","Gameshow Games: The Legend of Spiggle","2024-07-12"
"VSNwa63uHNo","Ganondorf Gets ""Head""  -  The Legend of Zelda: Wind Waker (Finale!) + Binding of Isaac: Repentance","2021-07-01"
"0GxnqEpmYoY","Garfield Kart - 08/28/18 - Jabroni Mike Full Streams","2018-08-29"
"5CscDNPuLbk","Garfield Kart","2016-11-15"
"8aO5jrRB034","Garry's Mod (with ""friends"")","2015-06-19"
"6k107HdExHc","GEEGA Wrecked My Game Show - That's My Streamer","2024-10-06"
"wOt3bp-MjQI","Genuinely DISTURBING YouTube Poops","2024-12-07"
"Rl2G8-d9QF4","GeoGuessr: Joker Edition + Escape Memoirs W/ @RevScarecrow - Jabroni Mike","2023-08-29"
"qseyVqKpNVo","GeoGuessr: Lands Unknown - Jabroni Mike","2023-06-13"
"v5ejKi7-OiY","GeoGussy - GeoGuessr [Jabroni Mike]","2022-10-06"
"n3_4lyWq6X0","Geogussy - Jabroni Mike","2023-03-12"
"wuI8zA6M4vA","GeoRecap - Twitch Recap + GeoGuessr + Apex Legends (Jabroni Mike)","2022-12-14"
"-bQw6yhRZzU","Get a Load of Game Gear Sonic Games - Sonic Origins - Jabroni Mike","2023-07-20"
"EkvLpRthooE","Get Down! - Jurassic World Evoulution 2 Jabroni Mike","2023-05-14"
"Wjh23ICixDU","Get Fused, Freak! - Pokemon Infinite Fusion - Jabroni Mike","2023-04-17"
"_fnBEfQiEMU","Get in the Biker Gang, Shinji! - Yakuza 0","2021-04-08"
"HQATinSzohQ","Get Your Hands Off My Freedom - Helldivers 2 w/ FredikKnudsen, Porcelainmaid, Revscarecrow & Ashe","2024-03-01"
"G-tN2hMg-I8","Get Your Hands Off My Pien - Pien + Suika Game + Super Mario Bros. Wonder - Jabroni Mike","2023-10-30"
"wIWs2Du_efA","Getting a Goth GF - Paper Mario: The Thousand Year Door (Finale!)","2021-01-21"
"PPEpoB7UEG8","Getting Jumpscared in The Classrooms","2024-05-16"
"UUECwCEwL3I","Getting Kicked Out of a Mall w/ Limealicious - Jabroni Mike IRL","2023-12-26"
"XSSmKjg-W88","Getting Over It - Jabroni Mike Full Streams","2019-03-07"
"MRh7n54H2wI","Getting the Job Done - Pokemon Legends Arceus","2022-01-30"
"3JgknNGKdXs","Ghost Adventures: Haunted Gabagool Factory - Luigi's Mansion Dark Moon","2019-08-31"
"_f5MTO6abBA","Ghost Hunters: Abandoned Plumbing Academy! - Luigi's Mansion Dark Moon","2019-09-06"
"bKP9-gH22mY","Gio Gambino and Dirk Intense hit Los Santos - GTA RP NoPixel 4.0 - Jabroni Mike","2024-01-06"
"N_SBPCvySao","Gio steps into the Sewers - GTA RP NoPixel 4.0 - Jabroni Mike","2024-01-11"
"iHpipTpG-S8","Girls' Night Out - Resident Evil 6 (w/ Limes!)","2021-10-15"
"mEsLaNOxR5A","Giygas, Giegues, and Gyiygs - Earthbound (Finale!)","2020-01-28"
"ewK2nMsIjFg","GMod with Mods - Jabroni Mike: Full Streams","2018-01-14"
"o9GOXLxuRys","Goin' Commando - Risk of Rain 2","2020-08-27"
"hK3Jj7n9eYw","Going Nuts For Squirrel Girl - Marvel Rivals","2024-12-13"
"kj2IlTN8kPo","Going Quackers - Animal Crossing: New Horizons","2020-06-06"
"B7xyN-6P6I4","Going to a Gator Farm w/ Limealicious - Jabroni Mike in Florida IRL","2023-12-30"
"6vza0MzcnAQ","Going To Anime Girl War - Girls' Frontline 2: Exilium","2024-12-10"
"L5-fCyn8fRk","Going Viral in Content Warning with Limealicious, Hackerling and Fyrus","2024-04-04"
"_ONXA8hqwTg","Good Morning USA - Sonic Adventure 2 Mods + Viewer OC's","2020-06-20"
"0bk3okYRv04","Goodbye, Doctor! - Shadow the Hedgehog","2022-04-29"
"g_tf44XBMyQ","Googaggy - Geoguessr (Jabroni Mike)","2023-01-04"
"82Q6EbGWHXQ","Google Doesn't Want You to See this Stream - Popee The Perfomer + HeadBangers - Jabroni Mike","2023-11-04"
"em5JylRt6qw","Google Reviews of Natural Features W/ Fredrik Knudsen","2023-02-15"
"KbALaoxTdtw","Goon Squad - Elden Ring","2022-06-17"
"mk5ySUYUA9I","Goonmaxxing and Mogpilling - PUBG + Palworld - Jabroni Mike","2024-01-28"
"g9ppupQWmyM","Gotta Mash Those Buttons! - Hyrule Warriors: Age of Calamity","2020-11-26"
"HC-8hAK_Zxk","Gotta Oob Em All! - Ooblets","2020-07-22"
"lKTyienpv5s","Grandpa Mike Malds at Retro Games","2024-06-21"
"Ro0Vpi058m4","Graveyard Keeper & The Curious Expedition - Pledge Picks #1 Jabroni Mike Full Streams","2018-09-02"
"CNaSzPOB9vM","Greatsword Goofs - Elden Ring","2022-05-27"
"O4YBypCZK1o","GreatZott's Secret Santa ""Gift"" - City of Fools - Jabroni Mike Full Streams","2019-01-18"
"hQ0cUdr-cPw","Grow Home - 1 / 2","2015-03-04"
"uKLwYbwg5T8","Grow Home - 2 / 2","2015-03-04"
"DaWwkYpt_no","Growing Tea For Ostriches - GTFO w/ Rev, FredK, and Wil!","2020-03-18"
"l1xSxoqa28o","Grumpy Home Poopadise - Animal Crossing: New Horizons 2.0","2021-11-06"
"8hhATf2Ocb0","Grunty Does Dallas - Banjo Kazooie","2020-05-11"
"5rutNuMzNbQ","Grunty Gone Wild - Banjo Kazooie (Finale!)","2020-06-03"
"OoAFf8U0p-k","Guess The Mystery Character - WHO ASKED??? - Jabroni Mike","2024-02-29"
"RgR7pGyRd5w","Gun Puns","2016-05-16"
"U5hSXAjhIjk","H-Fi Cat Licking - Hi-Fi Rush (Part 2 Finale) + GeoGuessr","2023-02-08"
"Ks1gNbl6eIo","Happy Bappy, Jabroni Pappy - Animal Crossing: New Horizons","2021-12-27"
"U7gJNEgn-e8","Happy Birthday J-Chan! - Tomodachi Life","2021-09-29"
"VmbS-5WqWPc","Happy Birthday Sanic! (ROM Hacks) PART1","2016-06-10"
"YOu34NNaStY","Happy Birthday Sanic! (ROM Hacks) PART2","2016-06-10"
"fp2WoH4VVxk","Harv's Legitimate Business - Animal Crossing: New Horizons","2020-06-10"
"n6i0hWAaqlQ","Hatoful Boyfriend","2015-03-08"
"gr76iVWcASk","Hatsune Miku's Repentance - The Binding of Isaac: Repentance","2021-09-07"
"nNuSyo4NEis","Haunted Plumber Forced Out Of Retirement (Gone Wrong) - Luigi's Mansion 3","2019-11-02"
"H-3Kq6_d6P8","Have Fun, NOW! - Jabroni Mike YLYL","2023-08-12"
"HV9hjQr6Bwk","Have You Seen The Bottom? Ready For The Top? 07/18/19","2019-08-04"
"15v7-qgU7CU","Having Big Runs With Friends - Splatoon 3 w/ Geega, @Limealicious & @hackerling","2022-12-11"
"ZOeId4pM2M4","He Died To Save You From Mobile Game Ads - Jabroni Mike","2023-05-24"
"9I_wpIQmDDA","He Who Is Penitent Is Almost Innocent - Blasphemous","2019-09-26"
"hT64XB3Q_6g","He's Actually Enjoying It!? - Sonic Frontiers (Part 2)","2022-11-14"
"lmViwV4MU68","He's ADDICTED - Subway Surfers + Suika Game + Risk of Rain Returns - Jabroni Mike","2023-11-08"
"8KIROTn5N2c","He's Addicted Again  -  Pizza Tower Noise Update #3","2024-03-24"
"bjVCKg2qN1s","He's Addicted to Bootleg Men - Palworld - Jabroni Mike","2024-01-23"
"OpqfXQyhdIk","He's Called Pledge Pickle Rick - Patreon Pledge Picks (Finale!)","2020-05-14"
"TiwHPvFi5D4","Heart of the Cards - Inscryption","2021-12-18"
"YzlZi9GMgSg","Heartbreak on Spagonia - Tomodachi Life","2021-12-08"
"vVzna9H2Z3c","Heavy GasðŸ’¨Heavy Rain (PART 1)","2022-09-09"
"xWemNCryaBQ","Heavy GasðŸ’¨Heavy Rain (PART 2) + Genshin Impact (PART 2)","2022-09-16"
"jxJaetyCHps","Heinous Immersion-Destroying Bug Simulator 4 P2","2016-04-02"
"5Y_cgE9pY6w","Heinous Immersion-Destroying Bug Simulator 4 P3","2016-04-02"
"h-kKBAVAnP4","Heinous Immersion-Destroying Bug Simulator 4","2016-04-02"
"fLGVKnWinkE","Hell Is Filled With Meat - Doom Eternal","2020-03-25"
"WFn44rS8y8k","Helldivers 2 with FredrikKnudsen, Jameskii, Limealicious & More","2024-02-25"
"7NN9V681Fq4","Helldivers 2 with Jameskii & More! - Jabroni Mike","2024-03-14"
"qRbgonY1pIE","Helldivers 2 with Vinesauce, Fredrik Knudsen and Criken","2024-12-15"
"TWjooj_KSiI","Hello Kirby - Animal Crossing: New Horizons + Kirby Super Star Ultra","2021-03-27"
"ZB2-GVKBHs8","Her Name Was Moisty - Pokemon Colosseum","2020-03-10"
"4al7TGG11nA","Hey Pikmin! - 7/31/17 - Jabroni Mike: Full Streams","2017-07-31"
"YDr41kSACaU","Hey Pops, Does This YLYL Work? - Jabroni Mike","2023-10-07"
"4w78uu0Qdmw","Hey! Pikmin - 8/8/17 - Jabroni Mike: Full Streams","2017-08-10"
"TuGmH3YdBfc","Hey! Pikmin - Jabroni Mike: Full Streams","2017-08-25"
"9bqKmIYS3No","High-Contrast Mike Action - Sonic Unleashed","2021-02-08"
"IyPVBdEDFbw","Highly Cerebral GeoGuessr - Jabroni Mike","2024-03-04"
"js3yHr89o4U","Hipster Android Streamer - Detroit Become Human (Part 3 FINALE) Jabroni Mike","2023-02-19"
"4mhLqrtWGBc","Historically Accurate Smash or Pass","2023-01-09"
"IikBXNZtCfM","Hoarding Simulator 4","2016-04-01"
"Yeyat77cSwU","Hog Modification 101 - Sonic Adventure DX: Randomizer + Mods!","2020-02-16"
"EIoRyG8ZxKo","Holiday Saacin'- The Binding of Isaac: Repentance","2021-12-20"
"kxY52WRzy_I","Home on the Rage - Atomicrops","2020-06-05"
"uzs4uR5q-Aw","Honor Among Thieves - Pokemon Colosseum","2020-03-04"
"1KGWx0vpRJM","Hooked on Bugs - Animal Crossing: New Horizons","2020-06-29"
"dx_9j9xXs14","Hooked on Phat Nutz - Mario Kart 8 Deluxe","2021-06-06"
"NpQ1I0Tevuo","Horrifying Roblox Games + The Front + Lords of the Fallen - Jabroni Mike","2023-10-14"
"UdyN8FG56dM","Hot Buttered Monster Energy - Death Stranding","2020-01-23"
"G9swVZAm0ms","Hotline Miami - 1 / 2","2015-03-10"
"S8WW7IPj3BU","Hotline Miami 2: Wrong Number (Now with audio!) - 1 / 2","2015-03-16"
"j4DHe36Pq6I","Hotline Miami 2: Wrong Number (Now with audio!) - 2 / 2","2015-03-15"
"9b66NIlyyBQ","Hotline Miami 2: Wrong Number - 1 / 4","2015-03-10"
"g8YY9bTmAhM","How Make Bells From Turnips - Animal Crossing: New Horizons","2020-04-27"
"624HhiOq4Cs","How McNuggets are Made - Fall Guys","2020-08-30"
"ri6M5EmX-o8","How NOT to Train Your Dragon - Mobile Ad Mayhem + Marvel Snap - Jabroni Mike","2023-08-28"
"bIgAzDRN7-k","How To Build A Tarantula Island In Animal Crossing: New Horizons!","2020-03-24"
"JZFtzGhM8jY","How to Life on Wikihow with Fredrik Knudsen - Episode 2","2020-01-19"
"Tt4BxyDJYGk","How to Life on Wikihow with Fredrik Knudsen - Episode 3","2020-08-13"
"ArDGG0fJ6A8","How to Life on Wikihow with Fredrik Knudsen - Episode 4","2021-02-28"
"us7u4neKCv0","How to Life on Wikihow with Fredrik Knudsen - Episode 5","2021-04-19"
"ad2p8Wm_eao","How to Life on Wikihow with FredrikKnudsen - Episode 1","2019-11-19"
"WarSCA6dssI","Hrnngg... - Metal Gear Solid: The Twin Snakes","2022-07-03"
"djEdtu4LLAU","Humbling The Pain Away - Super Smash Bros. Ultimate","2021-01-08"
"ZIDPtPaWTII","Hungry Jurassic Freaks - Jurassic World Evolution 2 (Jabroni Mike)","2023-04-28"
"lXXGcmQ_clE","Hunting Spiders in Kill It With Fire 2","2024-04-19"
"luLc1za0YWE","Hydraulic Goon Channel - Jabroni Mike","2023-01-18"
"m-Rd6LJkuJo","Hydraulic Press or Pass? - YouTube Night W/ RevScarecrow","2022-11-30"
"M2NWQss1Ccg","Hydraulic Pressing Fake Pokemon - Pal World Reaction + Hydraulic Press Watchalong","2022-12-06"
"YDB39NUAP24","Hyperdeimseon Nitptunia - 5/17/17 - Jabroni Mike: Full Streams","2017-05-17"
"Zg7zoSfo68o","Hyperdimension Neptunia Part 2 - Jabroni Mike Full Streams","2018-01-26"
"V0dCY98ecuk","Hyperdimension Neptunia Part 3 - Jabroni Mike Full Streams","2018-03-05"
"6nl1ixcsOaw","Hyperdimension Neptunia Part 4 - Jabroni Mike Full Streams","2018-03-12"
"lmScjbNGVrU","Hyperdimension Neptunia Re;Birth 1 - Part 5 - Jabroni Mike Full Streams","2018-05-16"
"40WoSWwEgRQ","Hyperdimension Neptunia Re;Birth 1 - Part 6 - Jabroni Mike Full Streams","2018-06-12"
"YkbOwtwP5tw","Hyperdimension Neptunia; Rebirth with NepNep Facerig  - Jabroni Mike","2018-01-04"
"NSrgx-_28C0","Hyperdimension Olivia - Paper Mario and the Origami King","2020-08-21"
"-26L7188Tno","Hypnospace Outlaw - Part 1 - Jabroni Mike Full Streams","2019-03-23"
"SPRCqe4LhIc","Hypnospace Outlaw - Part 2 - Jabroni Mike Full Streams","2019-03-28"
"qzh1rVD5X9g","Hypnospace Outlaw - Part 3 Finale! - Jabroni Mike Full Streams","2019-04-10"
"Kkxg9e0oetA","I Bless The Rains... - Risk of Rain 2 w/Fredrik Knudsen!","2019-09-23"
"3ca6ClQ6kQI","I Hate Mondays - Tubesday w/ Revscarecrow","2022-12-12"
"tvsbzytueyo","I Heart Nishiki - Yakuza 0","2021-03-13"
"OdxQPZr2edU","I Just Bought More Beans In The Metaverse! - Jabroni Mike YLYL","2023-04-26"
"KAHpsmijGm8","I Kick Aliens For The Lord - From Space + FAITH The Unholy Trinity (Part 2)","2022-11-12"
"k1OPVxUs9F0","I Looked at More of My Viewer's Weird Rooms","2024-09-07"
"uE-7gNKZHIc","I Must Pick Men - Pikmin 4 - Jabroni Mike","2023-07-22"
"kj23Jpo3_FI","I Played The Most CHAOTIC Horror Game With Vinesauce Joel","2024-10-09"
"G2SuPDvhBCM","I Took Laimu to The San Diego Zoo","2024-09-19"
"IlGaQrwmcuI","I Want a Divorce - It Takes Two (w/ RevScarecrow!)","2021-03-30"
"Iuaqpio_ekE","I Watched The Most Confusing Animated Movie","2024-09-30"
"nHxmMtfRQ88","I Watched The Sonic The Hedgehog 3 Movie Trailer","2024-08-28"
"c3G_PTF8fuM","I'm Back from my Vacation, Let's Talk","2024-04-17"
"OToYTlqmKr4","I'm Sorry, Mike - Tomodachi Life","2021-11-25"
"_7kaRUqAqoU","I'm Under and I'm Mining and I'm Helplessly Addicted - Undermine","2021-01-07"
"7AT4evRcpC8","I'm... Cute? - Yakuza 0","2021-03-15"
"49OxAVaYZgE","I've Been WRONG About This My Entire Life...","2024-11-27"
"XDKqD-diG7w","If You Keep Going The Way You Are Now...- Smash Bros. Ultimate","2019-09-05"
"R3Xt3uy9uyQ","Illegal TikTok React Stream - Jabroni Mike","2024-03-16"
"UB-FiYmgDCU","Imagine Jabroni Mike Happy - The Game of Sisyphus","2024-08-12"
"rv0-nd3l89M","In a World of Lies, Truth is Blasphemy - Blasphemous","2019-09-18"
"MAkddn2kZ8g","In Night City, You Can Jabroni Mike (CyberPunk 2077)","2023-01-19"
"xkMiCFQ7liA","In Pursuit Of Dusa - Hades","2020-05-11"
"1wiUrwPC3hY","In Search Of Daisy - Doom Eternal","2020-04-09"
"hBitSx892rI","In Search Of Trout Yogurt - Earthbound","2020-01-01"
"hqIuYFMlZWo","In'Sync At Last - ðŸŽµ Rhythm Heaven Megamix ðŸŽµ","2022-07-29"
"YKygiqxkuBg","Inaccesible Islands DLC - GeoGuessr - Jabroni Mike","2023-07-25"
"sLo9guYGVIw","Indigo Prophecy Interrupted by Farts","2024-06-09"
"IFslrSGvYko","Indigo Prophecy is a Failure of Game Design","2024-06-12"
"oVjvPlifVhQ","Infest the Rat's Nest - GTA RP NoPixel 4.0 + Infinite Crat - Jabroni Mike","2024-02-11"
"_FhVphEkgCA","Infinite Craft w/ Vinesauce & GEEGA - Jabroni Mike","2024-03-07"
"7Cz0_gdOM0Q","Infinitely Addicted to Craft - Infinite Craft - Jabroni Mike","2024-02-12"
"D6y0ZX4Q0aE","Inside, Outside - Sonic Heroes","2020-08-29"
"HiNpBEQZ_14","Intergalactic Dairy Farming - No Man's Sky Beyond","2019-12-16"
"mlOogKveytY","Interplanetary Meatballs - No Man's Sky","2020-02-26"
"trvmT8iI8Xc","Intervention: Addicted To Fishing - Animal Crossing: New Horizons","2020-04-30"
"pwnzBryoxY8","Intervention: Hooked on The Brothers - Mario Maker 2","2019-08-27"
"iu2qwkG24bU","Irritating And Getting Everywhere - Terraria w/RevScarecrow!","2020-04-04"
"SwgiXHYG0cQ","Is a Swapped Hog Still a Hog In The End? - Sonic '06 Finale","2019-09-04"
"reCFUf5CXxg","Is Pimpy Cake? - YouTube Trash React Night","2024-10-30"
"G76EvOUlkGI","Is This that Deathloop Game? - Loop Hero","2021-12-27"
"zTB2vKYG3s8","Isaac Antibirth - 6/28/17 - Jabroni Mike: Full Streams","2017-06-29"
"2lYSeK4GMzU","Isaac Antibirth 2/9/17 - Jabroni Mike: Full Streams","2017-02-10"
"vvTJU3e-WCc","Isaac Cheevage - 3/29/17 - Jabroni Mike: Full Streams","2017-03-29"
"Z8KVN1Hv4q8","Isaac Cheevo Quest - 3/25/17 - Jabroni Mike: Full Streams","2017-03-25"
"oZlO1oj2Dog","Isaac Cheevo Quest - 4/12/17 - Jabroni Mike: Full Streams","2017-04-11"
"aMSBijso3y4","Isaac Cheevo Quest - 4/15/17 - Jabroni Mike: Full Streams","2017-04-15"
"0spsOvSgWtQ","Isaac Cheevo Quest - 5/10/17 - Jabroni Mike: Full Streams","2017-05-10"
"LArcmG9PdY8","Isaac Cheevo Quest - 5/8/17 - Jabroni Mike: Full Streams","2017-05-08"
"SeLzXsCyR7g","Isaac Cheevo Quest -4/28/17 - Jabroni Mike: Full Streams","2017-04-30"
"gpp1V4ooj9w","Isaac Daily 'n Cake 7/10/16","2016-07-11"
"-wftpiv4fTM","Isaac Daily - 4/19/17 - Jabroni Mike: Full Streams","2017-04-19"
"Gqr-werdLY4","Isaac Daily - 7/4/17 - Jabroni Mike: Full Streams","2017-07-04"
"As3jsQPcqJs","Isaac Daily 10/21/16","2016-10-21"
"Mzq4szV5RXA","Isaac Daily 11/25/16 - Jabroni Mike: Full Streams","2016-11-25"
"PA0zi3oJL4w","Isaac Daily 11/28/16","2016-11-28"
"Mvn93YNkrZI","Isaac Daily 12/14/16 - Jabroni Mike: Full Streams","2016-12-14"
"vbW79Dc9Biw","Isaac Daily 12/16/16 - Jabroni Mike: Full Streams","2016-12-16"
"m9iSilwW96A","Isaac Daily 12/22/16 - Jabroni Mike: Full Streams","2016-12-22"
"h5Z8dFxKHQk","Isaac Daily 1/3/17 - Jabroni Mike: Full Streams","2017-01-03"
"LsXm3tfdhAo","Isaac Daily 6/15/16 & Selfie: Sisters of the Amniotic Lens","2016-06-14"
"pTBhL0mWa28","Isaac Daily 6/16/16","2016-06-16"
"ogiOY314QE0","Isaac Daily 6/29/16","2016-06-30"
"7Yx-9Bpozfs","Isaac Daily 7/12/16","2016-07-11"
"spH-Yq79vtY","Isaac Daily 7/14/16","2016-07-14"
"P4UfOhzY3Hk","Isaac Daily 7/15/16","2016-07-14"
"2wcp9-F5eJM","Isaac Daily 7/16/16","2016-07-17"
"YdevrBcW_18","Isaac Daily 7/17/16","2016-07-17"
"z2DH6pCfJYc","Isaac Daily 7/1/16","2016-07-01"
"SmQbLCVh3ZI","Isaac Daily 7/29/16","2016-08-05"
"Njvi2sKXLxo","Isaac Daily 7/2/16","2016-07-02"
"y2e9THe3jSk","Isaac Daily 7/3/16","2016-07-03"
"kLNQyl2DtUs","Isaac Daily 7/4/16","2016-07-04"
"TKR-qymvkoI","Isaac Daily 7/6/16","2016-07-07"
"QKrK_Xszhpg","Isaac Daily 7/7/16","2016-07-07"
"S9M4-SIAxeQ","Isaac Daily 7/8/2016","2016-07-08"
"tHoy-tmTrXI","Isaac Daily 9/11 and Bad Rats 2","2016-09-13"
"lUijL3iakVE","Isaac Daily 9/12","2016-09-13"
"nTDlqF9glVQ","Isaac Daily 9/13","2016-09-13"
"_5fyU9oo-qc","Isaac Daily 9/14","2016-09-14"
"Hor-mQu8T_g","Isaac Daily 9/15","2016-09-14"
"U1i6gAOv7ec","Isaac Daily 9/19/16","2016-09-24"
"9_lYBjvz9aQ","Isaac Daily 9/21/16","2016-09-24"
"SvkumocmubU","Isaac Daily 9/21/16","2016-09-24"
"ZCjBLSz01To","Isaac Daily 9/23/16","2016-09-24"
"RwWFAiRi8zQ","Isaac Daily 9/24/16","2016-09-24"
"M6gOZ4UBmUs","Isaac Daily 9/25/16","2016-09-28"
"TRWOeaaofg8","Isaac Daily 9/28/16","2016-09-28"
"xxZDCeEEWXU","Isaac Daily 9/29/16","2016-09-29"
"ek9NlaRUaC4","Isaac on Twitch - Jabroni Mike: Full Streams","2017-02-19"
"Mr74CcV74PQ","Isaac? We Got That! - The Binding of Isaac: Repentance","2022-04-14"
"xy5tiMvfAWA","Isabelle's Almonds - Mario Kart 8 Deluxe","2021-02-12"
"JAVE4U1LtXU","Isabelle's Wild Evening - Mario Kart 8 Deluxe","2021-05-21"
"g2FrYuBFMUg","Isla Chuga Fishing Jamboree - Animal Crossing: New Horizons","2020-07-12"
"aRcU0ngGF_M","Isla Chuga Renovations - Animal Crossing: New Horizons","2021-11-14"
"PBLM-7vKJVw","Island Life is the Life for Me - Tomodachi Life","2021-08-15"
"JPPB3VBkte4","It Felt Like Pants - Kirby's Epic Yarn","2021-07-16"
"oTI1CTp9ezo","It's a Mad, Mad, Mad, Mad Mario - Super Mario 64","2020-09-27"
"HXDDap_BXsc","It's a Skill Issue - Rhythm Heaven Megamix","2022-07-21"
"lHYT8qFOa5o","It's Almost Over - The Binding of Isaac: Repentance","2022-07-14"
"GUNilQ8e66g","It's Isaac! - The Binding of Isaac: Repentance","2022-03-13"
"5azw04RYdYs","It's Spring Again?","2016-07-11"
"IDqzdm-FVA0","Italian Experiences Pizza Horror At Tony's","2024-04-29"
"Ce37uadjg5k","Italian is MAD at Food! - Meattubing","2022-03-08"
"-rU0We0A174","Italian Lethal Company with Bricky, Nagzz, Vinny, and More!","2024-11-21"
"pQ23C0Mn334","Its Called Mythology, Dad! - Hades","2020-05-07"
"qhrJaenqdS4","Iâ¤ï¸Big Man - Splatoon 3 Splatfest World Premier!","2022-08-28"
"oKe-y1R6bII","Jabroccoli Mike - Baldur's Gate 3 w/ @RevScarecrow, @Limealicious and @hackerling - Jabroni Mike","2023-08-18"
"gT1lm7bKNUM","Jabroni Candy Man - Jabroni Mike Candy Making Stream","2023-06-09"
"AyF2YwGh3GI","Jabroni Feud - Hivemind + The Binding of Isaac: Repentance","2021-05-02"
"_1_IUJagsk4","Jabroni Mike at TooManyGames 2024","2024-07-05"
"ExmPLQC6X8Y","Jabroni Mike Channel Trailer","2017-10-03"
"FfVksRTiWsg","Jabroni Mike Gets Isekai'd to Fairy Tail 2","2024-12-16"
"VvaAVx6XjEU","Jabroni Mike Plays Franken RPG","2024-06-14"
"vvd2XoUxo0E","Jabroni Mike Saves The World - Patreon Pledge Picks","2020-01-12"
"mngGXB8MmtU","Jabroni Mike Twitter-fication - Browsing Twitter","2023-02-16"
"dTF85_-e_I8","Jabroni Mike's Dino Rap Career Debut - Jurassic World Evolution 2","2023-12-13"
"8gj9AWOc0Tg","Jabroni Mike's Green Screen Movie Night","2024-08-09"
"4o2qsMCmJM0","Jabroni Mike: Full Streams Live Stream","2017-02-28"
"Y_Qx0PNr008","Jabroni Mike: Full Streams Live Stream","2017-05-27"
"7JwfonYA27U","Jabroni Mike: Full Streams; Full Streams Live Stream","2017-05-27"
"K4F0woovF8o","Jabroni Mike: Full Streams; Full Streams Live Stream","2017-05-28"
"qJVCREbrmOk","Jabroni Miser YLYL - Jabroni Mike","2024-02-15"
"ZRHpclwFZxY","Jabroni Origins - Sonic Origins - Jabroni Mike","2023-07-05"
"io6EpCvnl8Y","Jabroni Puzzle Solving - A Little To The Left + Steamworld Build","2023-01-27"
"hCpogwwNhcE","Jabroni Reads: All Tomorrows (w/ Fredrik Knudsen!)","2022-04-09"
"AyfmvF8lX1U","Jabroni Reads: All Tomorrows (w/ Fredrik Knudsen) Part 2!","2022-07-03"
"FdzTg9UCr4o","Jabroni Reads: Empress Theresa (finale!)","2019-10-22"
"nqyAPJM_y38","Jabroni Reads: Empress Theresa","2019-10-12"
"cggD2dCw5Zs","Jabroni Reads: Hogwarts School of Prayer and Miracles","2021-01-09"
"fp-Bh9_l26o","Jabroni Reads: My Immortal Fanfic with Chat Art! - Jabroni Mike Full Streams","2018-04-25"
"4ZK0bN13oqs","Jabroni Reads: Old Man Henderson (w/ Fredrik Knudsen!)","2020-06-06"
"vr7j586dY7U","Jabroni Reads: Sonic High School Fanfic - Jabroni Mike Full Streams","2017-12-06"
"rmx9JNmKl44","Jabroni Reads: Sonic High School Part 2 - Jabroni Mike: Full Streams","2018-01-14"
"hGWhFxJb0SM","Jabroni Reads: The Eye of Argon (w/ Fred Knudsen!)","2020-02-23"
"PQVJ8A60JpA","Jabroni Rush - Hi-Fi Rush (Part 1)","2023-02-06"
"67OgSjWvdkk","Jabroni-Chan and Rev Browse YouTube (w/RevScarecrow!)","2021-05-11"
"j20qvBXji1g","Jabroni-Chan and Rev Browse YouTube Part 2! (w/RevScarecrow!)","2021-08-03"
"761PJ2yRubs","Jabroni-Chan and Rev Browse YouTube Part 3! (w/RevScarecrow!)","2021-09-28"
"PNfjwO2k7r8","Jabroni-Chan and Rev Browse YouTube Part 4! (w/RevScarecrow!)","2021-12-21"
"D233Ne6SGJw","Jabroni-Chan Reads: Half-Life and Steven Universe Fanfiction","2021-03-20"
"-JE6SNVlHkI","Jabroni-Chan Reads: Wattpad Naruto Fanfics","2021-03-07"
"0cYDgEIQtRw","Jabroni-Chan Reads: Wattpad Sonic FanFics","2021-01-23"
"_Garrusj5qY","Jabroni-Chan Vs. The World - Geoguessr + More!","2021-07-24"
"xdL0Zo778OU","JabroniBob - SpongeBob SquarePants The Cosmic Shake (Part 2 Finale)","2023-02-03"
"DMWduRYNpo0","Jabronified Rhythm Heaven - Jabroni Mike","2023-11-11"
"2ljhnZQQMuc","JabroniMike gets LOCKED IN for Kaya's Prophecy","2024-11-19"
"kJWX_5ZbBnk","JabroniMike Makes a MESS in Monster Mop Up","2024-11-22"
"ohG6wELXbXc","Jack Black's Panda-Monium - Pokemon Sword: Isle of Armor","2020-07-03"
"7SKQ4sHwci0","Japanese Sopranos - Yakuza 0","2021-02-10"
"T_RtZOLmzuk","Jarring Sparring - Pokemon Sword: Isle of Armor","2020-07-11"
"9zex_1RKwPc","Jed's Holiday Special 2018 - Jabroni Mike Full Streams","2018-07-04"
"PNaz992B1RI","Jellyfish Fren - Chatting + Elden Ring","2022-05-23"
"bmupl4-qqM4","Jiggle Armor - Shantae and the Seven Sirens (Part 3)","2020-06-17"
"BwxBeuIeLNY","Jiggling and Wiggling - Shantae and the Seven Sirens (Part 1)","2020-06-12"
"oMZ55P5rqNk","Joel Saves My Stream - Joey's Castle","2024-11-26"
"h_DrLlY3ww0","Joey's Castle Round 2 with Vargskelethor, SimpleFlips and Marco","2024-05-22"
"gQPn_TLtahM","Joey's Castle with Vargskelethor, SimpleFlips and Marco","2024-05-14"
"CR8rt5x0IcE","Judge Jabroni Mike - Quizzes + Streamer's Court","2023-05-21"
"jRijVF0cA3s","Judgement Bay is Inevitable - Tomodachi Life","2022-01-05"
"tNeuR8ksiSI","Juice Galaxy is One of The Games of All Time","2024-06-07"
"wz87HhDe7xg","July 4th 2019 - Extreme Roads USA - Jabroni Mike Full Streams","2019-07-05"
"p0aYgS6UJ6s","Jungle Hijinx - Donkey Kong Country","2021-11-17"
"CXCVHLv2TrE","Jurassic World Evoution 2 Electric Boogaloo - Jabroni Mike","2023-04-19"
"C4pZ_jGF8fU","Jurassic World: Evolution (and Slime Rancher!) - Jabroni Mike Full Streams","2018-06-13"
"kUkEj2Z5Wpk","Jurassic World: Evolution - Part 2 - Jabroni Mike Full Streams","2018-06-28"
"Hg1t8Fz8Mhw","JUST CHATTING AND MORE PROBABLY","2023-07-05"
"DCAVRoygTxM","JUST CHATTING: SMACK-TALKING TWITCH, MY DATE WITH YOUR MOM, & MORE","2023-06-15"
"rsIF4JcVdas","JUST CHATTING: SMACK-TALKING TWITCH, MY DATE WITH YOUR MOM, & MORE","2023-06-14"
"gZP8WTiBuuU","Just Shapes and Beats - Jabroni Mike Full Streams","2019-02-24"
"KWcyTPok5_Q","Just Two Guys on a Plank - Raft + Hades (w/ RevScarecrow!)","2020-11-24"
"zgzOr6zajGk","Just Yapping Live from Germany","2024-04-10"
"P9ndoxM-Vm8","Karting for Direct Relief! - Mario Kart 8 Deluxe (w/Rev and Friends!)","2022-05-03"
"Pqv326jxk2Q","Kero Blaster 9/23/16","2016-09-24"
"7zSoZL_Tkvo","Kero Blaster","2016-09-29"
"KkgH5fSKoY0","Kero Blaster","2016-08-28"
"-rMNYNQrMPQ","Kevin Lives in Sons of the Forest with Revscarecrow","2024-04-01"
"BIG2_n_OFTQ","Kicked to the Curb - Jabroni-Chan Reads: Wattpad Sonic and Yakuza Fanfics","2021-04-10"
"aWwbbjAMTNk","Killing Floor 2","2015-09-06"
"JygJ8SYVzAg","King of the Castle - Jabroni Mike","2023-03-14"
"Lff_cpop8RY","Kirby and the Facebook Groups - Kirby and the Forgotton Land","2022-04-03"
"fzDS2sxxnFI","Kirby Forgor - Kirby and the Forgotten Land","2022-03-26"
"LPGqzcv2LYs","Kirby Gets Audited - Kirby 64","2020-02-13"
"D-jyit9WliM","Kirby Learns the Truth - Kirby and the Forgotten Land","2022-03-31"
"T3d5yLxw0TA","Kirby Return to Baby Game (Part 1) - Jabroni Mike","2023-02-27"
"S1Ao1KJwz9o","Kirby's Poggers Yarn - Kirby's Epic Yarn","2021-07-21"
"6KGu6b_LnNo","Kirbymari Damacy - Kirby and the Forgotten Land","2022-03-28"
"j_pH4WQwbwc","Kirby: Planet Robobot - Part 1 - Jabroni Mike: Full Streams","2017-10-10"
"y5kvQl2mICc","Kirby: Planet Robobot - Part 2 - Jabroni Mike: Full Streams","2017-10-13"
"EyIqes5jd14","Kirby: Planet Robobot - Part 3 - Jabroni Mike: Full Streams","2017-10-27"
"6CeuTGEfFPE","Kirby: Star Allies - Jabroni Mike Full Streams","2018-03-23"
"wiavwReTqgY","Kirby: Star Allies - Part 2 - Jabroni Mike Full Streams","2018-03-29"
"0oVOeOKb0S8","Kitchen Simulator","2016-08-28"
"b8HxZMehiaw","Knight of the Edge - Sonic and the Black Knight","2021-07-08"
"OCQBIsrl_pA","Knuckles Fights Colonialism - Sonic Adventure DX: Directors Cut (Finale!)","2020-02-09"
"8ZUoHp_MmHY","Knuckles' Chaotix (with Imakuni!) - Jabroni Mike Full Streams","2019-01-10"
"KtwgXpvL7tU","Kong Estate With Fred Knudsen - Jabroni Mike","2022-11-11"
"60H7z3mZwV0","L.A. Noire (Part 1)","2015-05-21"
"2vG6bXuO-SY","L.A. Noire FINALE/ Time Ramsesside: A New Reckoning/ Day One: Garry's Incident","2015-05-28"
"2lkqEKPd568","L.A. Noire","2015-05-25"
"6YHx3GUjQLU","L.A. Noire","2015-05-28"
"d05BgQRPZ7w","L.A. Noire","2015-05-23"
"lvmi1Znrk3E","L.A. Noire","2015-05-23"
"PMIs_DOn5IE","L.A. Noire","2015-05-28"
"ULQGPv6zcPo","L.A. Noire","2015-05-23"
"eNti9J9POpk","Las Vegas + TwitchCon Recap | Jabroni Mike","2023-10-25"
"agVU45m4Xd4","Late Night Spelunking - Spelunky 2","2021-09-08"
"BL6uaZpdOB4","Leave It To Me! Here We Go! Got It! - Jabroni-Chan Reads: Wattpad Sonic Fanfics","2021-07-04"
"a0Ot-X9gDDw","Legend of Zelder: Breast of the Wild - Jabroni Mike: Full Streams","2017-03-08"
"BJ1dVHItrDM","Legend of Zelder: Twinks Gone Wild - Jabroni Mike: Full Streams","2017-03-09"
"yApSlxowC-4","Legend of Zelder: Twinks Gone Wild 3/10/17 - Jabroni Mike: Full Streams","2017-03-11"
"86QIKTBWm1c","Legend of Zelder: Twinks Gone Wild 3/13/17 - Jabroni Mike: Full Streams","2017-03-12"
"RAY4feURKA0","Legend of Zelder: Twinks Gone Wild PART 1 -  3/11/17 - Jabroni Mike: Full Streams","2017-03-11"
"5RFEn4PBJLo","Legend of Zelder: Twinks Gone Wild PART 2 - 3/11/17 - Jabroni Mike: Full Streams","2017-03-11"
"hNnRKSyab_o","Legs for Days - Noita","2020-10-21"
"zPf40_8L2CA","Let Me Show You My Pokeymans - Pokemon Sword and Shield","2019-11-15"
"X4Uecyj1XiQ","Lethal Company Update with Jameskii, Fredrik Knudsen and Buntime","2024-04-25"
"UYEPep7P5CE","Lethal Company Update with Kwite and Fredrik Knudsen","2024-07-14"
"IpCIpi-epRA","Lethal Company w/ Fredrik Knudsen, SimpleFlips, Limes and Rev - Jabroni Mike","2023-11-22"
"GKLqpdzQa7w","Lethal Company w/ Vinesauce, RubberRoss, Giwi, Limealicious & More! - Jabroni Mike","2023-12-18"
"B5ARXJRmm14","LetoPosting - Mario and Luigi: Bowser's Inside Story","2022-05-10"
"w10gnLjC2tg","Lfie is Stupid p2","2016-03-08"
"oyK7V60Sbck","Lfie is Stupid","2016-03-08"
"88uP-NhDV_w","Life is Strange","2016-03-04"
"KS09VHhvNqE","Life Will Not Be Contained - MikeRevt","2019-11-06"
"ZgVTFB04zkk","Life's a Mario Party - Mario Party Superstars","2021-10-30"
"X1joVe9Gh8M","Like A Box Of Chocolates - Patreon Pledge Picks","2020-03-09"
"TgJTmHc6mGs","Lil Fella's Time to Shine - Monster Rancher 2","2022-01-13"
"W6jiXWlV-Pc","Lil Fellas Chapter 2 - Deltarune Chapter 2","2021-09-21"
"sE6JUfa3AzQ","LIMBO (First half)","2015-05-17"
"2hQKK-O-nWE","LIMBO (second half)","2015-05-17"
"RbUj5qI__cY","Link SautÃ©s Some Nuts - Zelda Tears of the Kingdom (Part 4) Jabroni Mike","2023-05-18"
"4pYLtU41Als","Little Nightmares (Ending + The Depths DLC) - Part 2 - Jabroni Mike Full Streams","2018-10-26"
"wt3IQWPqBZ4","Little Nightmares - Part 1 - Jabroni Mike Full Streams","2018-10-21"
"SVQtfzwOVuk","Little Pink Fella - The Binding of Isaac: Repentance","2021-08-24"
"-zdcHSwljzs","Live from Magfest 2024! - Jabroni Mike IRL","2024-01-19"
"zLPupFgcksI","Live from TwitchCon Las Vegas 2023! - Jabroni Mike IRL","2023-10-20"
"3xu0-lOAgDU","Live from TwitchCon San Diego 2024!","2024-09-22"
"J8Ucww42D6s","Live From Twitchcon! - Jabroni Mike","2022-10-16"
"Nu4OXKobNnU","LIVE Jabroni Gator Wrestling! - Later Alligator","2019-10-25"
"a00nRwochJY","""Living Embodiment of Disappointment"" - Sonic Fontiers DLC + Cocoon - Jabroni Mike","2023-10-05"
"vbrBC6wELNc","Lois, We're in Undermine! - Undermine","2020-12-31"
"Q3JDZ1Jvrno","Long Live the Mermussy - Monster Rancher 2","2022-03-18"
"c-rcINIME6s","Long Time, No Fall - Fall Guys: Ultimate Knockout (w/RevScarecrow!)","2021-12-07"
"IpenySh0pDc","Looking at My Viewers' Weird Rooms","2024-07-16"
"dNs3lQOttU8","Looking at User Submitted TikTok Cringe! - Jabroni Mike","2023-11-27"
"6KaGi7sxaLE","Looking for Rats in Central Park - Jabroni Mike IRL","2023-08-17"
"iuiMFalZlsY","Looking for Rats in Prague IRL","2024-04-09"
"udMqcjLUPzU","Lore Batching - Mother 3","2020-10-19"
"t3GfWby_PK4","Losing My Mind to Game Theory Videos","2024-08-26"
"3YnUSOQk_GU","LotR Gollum Is Technically a Game - Jabroni Mike (Part 3 Finale)","2023-06-04"
"0QxIc6qhbDk","Love Coach Jabracula - Suck Up! + Game Show Games - Jabroni Mike","2024-02-18"
"bnxdk8OcSa4","Love Wins - Sims 4 (Part 3)","2022-12-31"
"O7gfYl0dB44","Low-Poly Terrors - Puppet Combo Games","2021-12-11"
"gAe5U7UkfWE","Lucario Comforts You ASMR - Pokemon: Brilliant Diamond","2021-12-02"
"EMrAAMDs98g","Luigi's Mansion - Part 1 - Jabroni Mike Full Streams","2018-10-14"
"dQkEDI9PsVI","Luigi's Mansion - Part 2 - Jabroni Mike Full Streams","2018-10-24"
"7JEbxiHXY9o","Luigi's Mansion - Part 3 - Jabroni Mike Full Streams","2018-11-08"
"aoTveNGh7aw","Luigi's Mansion - Part 4 Finale! - Jabroni Mike Full Streams","2018-11-14"
"Uo8655p37Pk","Luigi: a Defense Attorney for Yoshi? - Mario Maker 2","2019-08-19"
"1aDvjsdQvn8","Lumbago Sim 2019: Sciatica DLC - Death Stranding","2019-12-05"
"B73z_icK6HU","Mabroni Jike - From Space + Metal Gear Solid 2: Sons of Liberty FINALE (Part 3)","2022-11-12"
"EEHAq2VY5cY","Mad Max","2016-01-12"
"UDxclDrmKiU","Mailbirds Reporting For Duty - KeyWe (w/RevScarecrow!)","2021-10-19"
"StBTBc8_TUY","Majima's Wholesome Work - Yakuza 0","2021-04-14"
"-j2xwEFzRGg","Majora's Mask - 7/13/17 - Jabroni Mike: Full Streams","2017-07-13"
"kpQsiDStY-M","Majora's Mask - 7/20/17 - Jabroni Mike: Full Streams","2017-07-20"
"JJIYs9VuSDA","Majora's Mask - 7/27/17 - Jabroni Mike: Full Streams","2017-07-27"
"3N8VfZj40KM","Majora's Mask - 8/10/17 - Jabroni Mike: Full Streams","2017-08-11"
"bZ_T00jPfZw","Majora's Mask - 8/17/17 - Jabroni Mike: Full Streams","2017-08-18"
"iQVKdiNNrrg","Majora's Mask - 8/24/17 - Jabroni Mike: Full Streams","2017-08-25"
"JjMXun_d_F0","Majora's Mask - 8/3/17 - Jabroni Mike: Full Streams","2017-08-03"
"OFntnkZ4vDE","Majora's Mask - 9/22/17 - Jabroni Mike: Full Streams","2017-09-22"
"KPyBnPmyMis","Majora's Mask - 9/23/17 - Jabroni Mike: Full Streams","2017-09-25"
"X3DWJdK1O84","Majora's Mask - 9/7/17 - Jabroni Mike: Full Streams","2017-09-10"
"lWNiI3vO09I","Majora's Mask P1 - 7/6/17 - Jabroni Mike: Full Streams","2017-07-06"
"1WEYAzB9in0","Makin' More Marios - Mario Maker 2","2020-05-13"
"5cSCdXWQE0c","Makin' The Most Of Moist Men - Pokemon Colosseum","2020-03-16"
"ZD-RD7WLm34","Making a Volcanal - Jabroni Mike","2023-05-06"
"0FhHn0mkt9o","Making Fun of Extinct Species IRL","2024-11-12"
"HI2r9OPSo3w","Making Funny Noises in The Choicer Voicer","2024-08-14"
"GvnSjSpNX4A","Making Obscene Squid Noises in The Choicer Voicer","2024-11-08"
"wFWvlDIsKjY","Mald of Fortune - Wheel of Fortune + Jeopardy! - Jabroni Mike","2023-08-13"
"3ZP5-HBV5BU","Malding Quiz Master - Jabroni Mike","2023-01-11"
"vo_KwSPAYLo","Mama Meow - Super Mario 3D World + Bowser's Fury","2021-02-13"
"gchaWYrE_ZQ","Man Made Structures Smash or Pass - Jabroni Mike","2023-03-20"
"stjAqD0lwQQ","Manly Men Doing Manly Things - The Forest w/RevScarecrow!","2020-07-07"
"61Ur03tWPYU","Maria's Had ENOUGH - Shadow The Hedgehog and YTPs","2024-12-26"
"-jTb6ZJE82c","Mario + Manipulated Rabbids Image - Jabroni Mike","2023-01-10"
"AcQ_Dxafnwc","Mario and Sonic at the Tokyo 2020 Olympic Games: Opening Ceremonies","2019-11-07"
"KHWewc3w7Ug","Mario and Sonic: Tokyo 2020 - Men's Streaming Semifinals w/HuggbeesTV!","2019-11-27"
"w1iTDCzqwhk","Mario Gets Flattened - Paper Mario and the Origami King","2020-07-24"
"xtp8S3vXGlc","Mario Kart 8 (Plus bonus Isacc after!) - 03/02/18 - Jabroni Mike Full Streams","2018-03-16"
"M1WTbUCYOg0","Mario Kart 8 + P Ranking Pizza Tower (Part 4) - Jabroni Mike","2023-03-18"
"kSug_t8SdgY","Mario Kart 8 - 03/18/19 - Jabroni Mike Full Streams","2019-03-19"
"QPBmY7kieY8","Mario Kart 8 - 03/24/19 - Jabroni Mike Full Streams","2019-03-26"
"Yx0rVjBk6pM","Mario Kart 8 - 04/14/19 - Jabroni Mike Full Streams","2019-04-14"
"iBMlmPRjxAA","Mario Kart 8 - 04/28/19 - Jabroni Mike Full Streams","2019-05-01"
"u4C6P7IdLMY","Mario Kart 8 - 06/02/19 - Jabroni Mike Full Streams","2019-06-04"
"CMjDPRT5ovA","Mario Kart 8 - 07/06/19 - Jabroni Mike Full Streams","2019-07-08"
"Udr8MuJY7CY","Mario Kart 8 - 1/20/18 - Jabroni Mike Full Streams","2018-01-23"
"z2rGdLbhDME","Mario Kart 8 - 1/27/18 - Jabroni Mike Full Streams","2018-02-06"
"G2kt5_lS_GU","Mario Kart 8 - 2/12/18 - Jabroni Mike Full Streams","2018-02-28"
"SC5y5Mn5PuU","Mario Kart 8 Deluxe @ TooManyGames 2018! - Jabroni Mike Full Streams","2018-06-27"
"WgIgsw1poc4","Mario Kart V-Tuber Tournament - Jabroni Mike","2023-03-26"
"HY7jpb0Jlc0","Mario Party Extravaganza! - Mario Party Superstars (w/RevScarecrow, Fredrik Knudsen. and Huggbees!)","2021-11-04"
"16P3kt5_yeE","Mass Effect","2015-06-08"
"QpSvulfv6CA","Masterpiece (of Shit) Theatre","2016-02-27"
"tVViB3fUSxM","Masterpiece (of Shit) Theatre","2016-01-23"
"z_jboBm2VzI","Masterpiece (of Shit) Theatre","2016-01-12"
"uY5vFOdBJio","Masterpiece (of Sh*t) Theatre - 3/24/2017 - Jabroni Mike: Full Streams","2017-03-24"
"vxLToRlkP3I","Masterpiece (of Sh*t) Theatre - 3/31/17 - Jabroni Mike: Full Streams","2017-03-31"
"eGQLtgGUHzE","Masterpiece (of Sh*t) Theatre - 4/14/17 - Jabroni Mike: Full Streams","2017-04-15"
"oZzTPkQO8Xs","Masterpiece (of Sh*t) Theatre - 4/21/17 - Jabroni Mike: Full Streams","2017-04-21"
"BMsmYVOGIC0","Masterpiece (of Sh*t) Theatre - 4/7/17 - Jabroni Mike: Full Streams","2017-04-08"
"LBFkDGX2O1g","Masterpiece (of Sh*t) Theatre - 5/5/17 - Jabroni Mike: Full Streams","2017-05-05"
"Ki3YGQPphFY","Masterpiece (of Sh*t) Theatre - Jabroni Mike: Full Streams","2017-03-12"
"34BnRdx3gWU","Mayro Kratt DLC Wave 2 - Mario Kart 8 Deluxe","2022-08-08"
"GHKhOBvccpQ","Me after the lobotomy - YLYL + Genshin Impact - Jabroni Mike","2023-11-24"
"0kbQCjIW8f4","Me And The Boys Gardening Organically - Terraria w/RevScarecrow! (and FredKnudsen!)","2020-02-11"
"cI-BtqVMx0w","Me IRL - Mother 3","2020-10-10"
"wO9K2xKbnww","Meattube Mania - Marbles, Articles, and Lists, Oh My!","2022-01-26"
"B9Dd9yXUWMI","MeatTuber - Literally Nothing","2022-01-16"
"xoo3mE7bKlo","Meaty Rusted Metal - Doom Eternal","2020-04-12"
"b-s2F_IXUHA","Mech Arena: Robot Showdown - Jabroni Mike","2023-03-15"
"Pv-aENjQt9Y","Medieval Lethal Company with Fredrik Knudsen, Tobs and JuniperActias","2024-06-15"
"yspipAeQaOU","Meeting a Legend - Yakuza 0","2021-03-04"
"BM8Sxbh76zo","Mega Milk - The Legend of Zelda: Wind Waker","2021-06-03"
"9aiHZGgtdyY","Megaera Griffin - Hades","2020-07-09"
"-GtF5vdv2s4","Megussy Guessr - Quizzes + Geoguessr - Jabroni Mike","2023-04-21"
"yWfPMheHVxQ","Meme Game Monday: Sea Edition + ""Those Games"" + Sewer Rave - Jabroni Mike","2023-07-24"
"_2b-62gydj8","Meme Games Monday + Lies of P - Jabroni Mike","2023-06-14"
"uSqhn8ND8VY","Merry Birthmas - Isaac Afterbirth+","2020-12-25"
"J3qma-O9ejM","Merry Saacmas - The Binding of Isaac: Repentance","2021-12-25"
"7ZGywtvj_fE","Meta Knight's Grand Felt - Kirby's Epic Yarn","2021-07-28"
"GFczhn88Gns","Meta Knightmare - Kirby Super Star Ultra","2021-03-22"
"2i96RJGIAjQ","Metal Gear Soild 2: RAIDEN DIRTY (Part 2)","2022-10-29"
"UZ5vPkquSd0","Metal Gear Soild 2: RAIDEN DIRTY (Part 2.5)","2022-10-29"
"aECnDvybMGg","Metal Gear Tech Issues 3 - MGS3 Jabroni Mike (Part 2)","2023-04-10"
"ff3v0YymAvE","Metal Mario Music - Mario Maker 2","2020-05-18"
"-6IBAD3rl6U","Michael Gear Liquid: One-Eyed Snakes (Part 1) - Metal Gear Solid: The Twin Snakes","2022-06-24"
"trwhxrusmsQ","Michael Gear Liquid: One-Eyed Snakes (Part 2) - Metal Gear Solid: Twin Snakes","2022-06-24"
"qQ0s7RyqV08","Mighty Beans are on the Scene - Fall Guys","2020-08-14"
"05SQT-ecnkE","Mii Crossing: Old Horizons - Tomodachi Life","2021-08-25"
"UXR78--m20w","Miitopia - Part 1 - Jabroni Mike: Full Streams","2017-08-01"
"juAvYRBiuUw","Miitopia - Part 10 - Jabroni Mike: Full Streams","2017-09-12"
"NU3TDWSD4tA","Miitopia - Part 11 - Jabroni Mike: Full Streams","2017-09-20"
"hN0Em9x_aP4","Miitopia - Part 12 - Jabroni Mike: Full Streams","2017-09-26"
"OjarTwU9QYc","Miitopia - Part 14 - Jabroni Mike: Full Streams","2017-11-07"
"u5Ps5WjK-24","Miitopia - Part 2 - Jabroni Mike: Full Streams","2017-08-01"
"dus1q2Z6rkM","Miitopia - Part 3 - Jabroni Mike: Full Streams","2017-08-07"
"1u8dOakZy40","Miitopia - Part 4 - Jabroni Mike: Full Streams","2017-08-10"
"KGKIPFDJKBE","Miitopia - Part 5 - Jabroni Mike: Full Streams","2017-08-18"
"6PApMlnzRbA","Miitopia - Part 6 - Jabroni Mike: Full Streams","2017-08-22"
"ZhMS8vL78m8","Miitopia - Part 7 - Jabroni Mike: Full Streams","2017-08-25"
"GB5Qo5FY1HM","Miitopia - Part 8 - Jabroni Mike: Full Streams","2017-08-31"
"j1yILi7kM1M","Miitopia - Part 9 - Jabroni Mike: Full Streams","2017-09-07"
"eXpxuujo-PM","Miitopia Part 13 - Jabroni Mike: Full Streams","2017-10-03"
"zPeOmg9-Z-Q","Miitopia Part 15 - Jabroni Mike: Full Streams","2017-11-21"
"lNqdu7Lz43w","Miitopia Part 16 - Jabroni Mike: Full Streams","2017-12-05"
"lOY51wQ6ncg","Miitopia Part 17 - Jabroni Mike: Full Streams","2017-12-12"
"ncV9btbRWr8","Miitopia Part 18 - Jabroni Mike: Full Streams","2017-12-21"
"YFDO3ybjqug","Mike & @FredrikKnudsen Make Monk Glonch Tea","2023-05-01"
"l7QqejY5tbw","Mike & @FredrikKnudsen Read WikiHow","2023-05-27"
"DnEDNiFIov8","Mike Actually Likes It - Elden Ring","2022-05-23"
"aiFQ2DTveEw","Mike and Chat Create an Affront to God - Writing a Sonic Fanfic w/ Chat!","2022-05-07"
"O5qIrEQ3ytk","Mike and Chat Face the Music - AI Dungeon 2","2020-08-02"
"wlXjQKOLiAg","Mike and Chat Mon Some Huns - Monster Hunter Rise","2022-02-21"
"Ci7d69ve4M4","Mike and Chat's Bogus Journey - AI Dungeon 2","2019-12-18"
"1VJ4EW9U7mE","Mike and Chat's Excellent Adventures - AI Dungeon 2","2019-12-10"
"FLxAeGSu9d4","Mike and Fred - Cursed AI Image Showcase (w/Fredrik Knudsen!)","2021-07-29"
"01IyqWGIOTM","Mike and Rev Browse YouTube - Part 5 (w/RevScarecrow!)","2022-02-22"
"KCmd12pArXI","Mike and Rev Browse YouTube - Part 6 (w/RevScarecrow!) + Isaac!","2022-04-06"
"30mAMttp5zU","Mike and Rev Browse YouTube - Part 7 (w/RevScarecrow!)","2022-04-29"
"4-ByA5bNgzY","Mike and Rev Do More Stupid Internet Quizzes (w/RevScarecrow!)","2022-01-19"
"A2ZdGgQvKb8","Mike and Rev Do Stupid Internet Quizzes (w/RevScarecrow!)","2021-09-14"
"m6l_Em2FBp4","Mike and Rev's Undead Adventure - Project Zomboid (w/RevScarecrow!)","2022-01-04"
"DUWo4hTrBJ4","Mike Becomes a Wageoid - Supermarket Simulator - Jabroni Mike","2024-03-11"
"RtbsPlcGyhs","Mike Betrays Chat - Psychonauts 2","2022-05-30"
"NU8JVgUq2ZE","Mike Czechs out Prague IRL","2024-04-07"
"qwwDdT1dSaE","Mike Destroys Chat in Trivia Tricks - Gameshow Games","2024-08-10"
"cieUw-RlYeQ","Mike Eating Raw Furry Vegetables - YouTube Night W/ RevScarecrow","2023-01-03"
"aOvzBUSA0e8","Mike Finally Gets Dead God! - Fall Guys + Binding of Isaac","2022-07-30"
"_3v_j3wGTKE","Mike Finally Understands - Elden Ring","2022-06-10"
"bfPf8gcAnlM","Mike Gets Beaned - The Binding of Isaac: Repentance","2021-05-29"
"AV4g4HzZkac","Mike Gets Clicked - The Choicer Voicer and CLICKOLDING","2024-07-29"
"NEADkojWymE","Mike Gets Mad at Ridiculous Food Products","2024-10-14"
"H95TNgKkS9o","Mike Gets Probed - Destroy All Humans 2: Reprobed","2022-09-01"
"V5VpVLADZeM","Mike Goes To Yamada's House - Geoguessr","2022-08-31"
"AeUoYN_Gth4","Mike is Full Of Ice Cream - Kirby's Dream Buffet (With Mods!) + Cult Of The Lamb FINALE","2022-08-18"
"SlCJub-QqJM","Mike Is Jesus Christ - I Am Jesus Christ + Are You Smarter Than a 5th Grader","2022-12-04"
"rEcvglol0sk","Mike Judges your Strange PC Setups","2024-06-11"
"COXJw_8rrIc","Mike Killed Sonic! - The Murder of Sonic the Hedgehog + MGS3","2023-04-03"
"ebxZfRkXHW4","Mike Loses his Marbles - Meattubing","2022-04-07"
"-lIXgFi6-NM","Mike Loves the 'Saac","2016-03-04"
"31VUrsl6cSU","Mike Loves the 'Saac","2016-01-12"
"70AKVycxhaE","Mike Loves the 'Saac","2016-01-12"
"fuOrtZcUKek","Mike Loves the 'Saac","2016-02-23"
"g4YhfPRUDFg","Mike Loves the 'Saac","2016-03-07"
"imW4hgNvNgs","Mike Loves the 'Saac","2016-02-23"
"LONi0RBEvvs","Mike Loves the 'Saac","2016-02-19"
"N7TD73uUkPs","Mike Loves the 'Saac","2016-01-12"
"QwRyRhJmApY","Mike Loves the 'Saac","2016-02-19"
"bUKpH52AYXo","Mike Malds at Super Monkey Ball Banana Rumble","2024-07-09"
"D_KpjFTGIDs","Mike Never Plays Spelunky Again - Spelunky 2","2021-09-13"
"Rxy8hrlWMa8","Mike Plays Browser Games and Goes Bananas","2024-06-19"
"kwC3rRL4pxI","Mike Plays Dark Souls but with Crabs","2024-04-28"
"DvnK-qpmzzA","Mike Plays Honkai Star Rail and World of Goo 2","2024-08-07"
"VrEfv4UGVuE","Mike Plays LSD: Dream Emulator","2024-09-12"
"BZyRMLiKDZs","Mike Plays More Wario Land 3 by Ear","2024-07-02"
"wqEYSyZLte8","Mike Plays Wario Land 3 Finale!","2024-07-08"
"nCV_YH6z-Vo","Mike Reacts to Jeremy Fragrance and Other Youtube Garbage","2024-04-05"
"-DoQDnGN1b8","Mike Reacts to Killer Bean Forever","2024-03-31"
"YKaZshy7jcw","Mike Takes Quizzes and Experiences Hell","2024-05-25"
"yWrjWWTusSk","Mike The Copepod Diver - Dave The Diver - Jabroni Mike","2023-07-08"
"_QU_1l7AVS4","Mike The Foot Fiend - Meme Game Monday + Vaudeville - Jabroni Mike","2023-08-21"
"FsLSJjHa8QQ","Mike the Hedgehog - Jabroni Mike: Full Streams","2017-01-13"
"RoRhermlKcA","Mike Tries to be Wholesome - Meattubing + GeoGuessr","2022-06-20"
"6rjBtdx9eZg","Mike Watches Drunken Dragon and Ratatoing","2024-08-18"
"LS0olaV5IVk","Mike Watches the GeoGuessr World Cup","2024-09-16"
"X5LAJZ9OMPU","Mike Watches ""Our Drawings"" - Movie Night","2024-07-17"
"bZUp9XXpauk","Mike Wazowski's Wild Ride - Dead Cells","2020-06-04"
"WP6jUDx6MiA","Mike's Coming For Dead God - The Binding of Isaac: Repentance","2022-07-24"
"EExwAjOFWbk","Mike's Miku Birthday Drum Bash! - Jabroni Mike","2022-12-27"
"qmj4QJAXAyE","Mike's Miku Drum Bash! - Jabroni Mike","2022-12-22"
"39peqeiHUic","MikeRevt with RevScarecrow: Diversity 3 - Part 16 - Jabroni Mike Full Streams","2019-05-28"
"spnUNsdZE-4","MikeRevt with RevScarecrow: Diversity 3 - Part 18 - Jabroni Mike Full Streams","2019-06-11"
"U34an4pDHQ8","MikeRevt with RevScarecrow: Diversity 3 - Part 19 - Jabroni Mike Full Streams","2019-07-09"
"O-hp22DFGpE","MikeRevt with RevScarecrow: SevTech Ages - Part 11 - Jabroni Mike Full Streams","2019-03-27"
"r7yt3Ae90mE","MikeRevt with RevScarecrow: SevTech Ages - Part 13 - Jabroni Mike Full Streams","2019-04-16"
"7uodRjtvXiA","MikeRevt with RevScarecrow: SevTech Ages - Part 14 - Jabroni Mike Full Streams","2019-05-07"
"kzgOQt2Lmu4","MikeRevt with RevScarecrow: Sevtech Ages Mod! - Part 3 - Jabroni Mike Full Streams","2018-10-19"
"X8E5NslZAwU","MikeRevt with RevScarecrow: Sevtech Ages Mod! - Part 5 - Jabroni Mike Full Streams","2018-10-16"
"Zm7w-auQmLQ","MikeRevt with RevScarecrow: Sevtech Ages Mod! - Part 6 - Jabroni Mike Full Streams","2018-12-04"
"-mWN_5DlrOo","MikeRevt: Rock In The Pit - Part 8 - Jabroni Mike Full Streams","2019-01-23"
"RwQWp-SPHZc","MikeRizon - Jabroni Mike","2023-01-15"
"FULJ1cb7CMo","MikeStuck - Mario Kart 8 Deluxe","2021-04-23"
"-3pMH_M6ZDo","Mikewad Head - Metroid Dread","2021-10-15"
"jfy22vGIqu8","Mikewad Invasion - Tomodachi Life","2021-09-01"
"oQVKDLoMtC8","Mikufication For Charity - Stream of Conscience For Movember 2022","2022-11-26"
"sc53PONSGCM","Mind Meltingly Stupid Content Slop - Jabroni MIke","2024-03-09"
"uMHimTwvqhE","Minecraft with Jabroni Mike and RevScarecrow - Part 1","2017-12-04"
"yuuWxzVskZk","Mobile ADpocalypse - Mobile ADs Reaction + Genshin Impact - Jabroni Mike","2023-06-05"
"6wK0lAgUx_g","Mobile Game Ads of the Confusing Variety","2024-07-13"
"7nJyv_ji7c8","Mod Mansion - Resident Evil Village","2021-06-12"
"o7SjKHQTTOY","Mod Mayhem - The Binding of Isaac: Repentance","2021-08-13"
"mBAphTPc2P4","Modded Lethal Company w/Fredrik Knudsen, PorcelainMaid, SimpleFlips and more! - Jabroni Mike","2023-12-02"
"J0aoqpyfVzo","Moisture Farming 101 - Pokemon Colosseum","2020-04-05"
"VrVRDTWZU4I","Moisty's Back, Alright! - The Binding of Isaac: Repentance","2021-06-19"
"k9iRB0QSEww","Moisty's Mysterious Misadventures - Tomodachi Life","2021-09-15"
"a0FO8JU7gtg","Monday the 20th - The Quarry","2022-06-21"
"GjqXBYo1Z5I","Mondays... - The Binding of Isaac: Repentance","2022-01-26"
"QKxyk78aYUA","Monster Girl Maker - Monster Rancher 2","2021-12-30"
"oZONqQ_Sw-4","Mooncat Is The Game Of All Time - UFO 50","2024-10-01"
"tmtQAX2xU1w","Mordhau - 05/07/19 - Jabroni Mike Full Streams","2019-05-08"
"4QA2r3tXPYk","More Bootlegs","2015-05-31"
"MCOcCWA3h_M","More Bootlegs","2015-05-31"
"pwx2wG9OaL0","More Isaac, More Problems - The Binding of Isaac: Repentance","2021-06-05"
"9kFNXZybTBY","More Majima Mayhem - Yakuza 0","2021-03-17"
"OJ3ATJvlc5E","Motion Controlled Mayhem - The Legend of Zelda: Skyward Sword HD","2021-07-24"
"Uo1KEMuMNHk","Mount Your Friends - 08/28/18 - Jabroni Mike Full Streams","2018-08-28"
"aTM0cx6qwUk","Mouthwashing Is The Most MESSED UP Game I''ve Played","2024-10-08"
"77d1BsvybzM","Movember Mon Mining - Pokemon Sword: The Crown Tundra","2020-11-07"
"VVp6yKk2qsI","Movie Night - Maradonia and The Shadow Empire w/ Fred Knudsen!","2019-10-08"
"qejFwoSdUuU","Movie Night - Wolf Tracer Double Feature w/ Fred Knudsen!","2020-01-26"
"xtBiD5wQ0UA","Mr. Libido's Grand Debut - Yakuza 0","2021-02-25"
"sP8McNSgR2E","Muscle Elf SOLVED! - YouTube w/ Revscarecrow","2022-10-26"
"e-81iKR2p_Q","Mushroom Vs Star Splatfest! - Splatoon 2","2021-01-16"
"lvUhfRk2NMc","My Memoirs Of Moisty - Pokemon Colosseum","2020-03-22"
"lv3YpuF4tNo","My Most Controversial GeoGuessr Stream","2024-08-08"
"E1TEp0AGPPQ","My Most Scuffed IRL Stream - Jabroni Mike at Anime NYC","2023-11-17"
"WdwoqnSCptc","My Strange Addiction: I Married a Haunted House - Luigi's Mansion Dark Moon","2019-09-28"
"9I1o07UUzoM","My Time at Portia - Jabroni Mike Full Streams","2018-03-03"
"kEBtPNJySso","Mythology Made FUN! - Hades","2020-07-01"
"bH4oQtq8WEU","Nagzz, Tobs and Altrive DESTROY ME in Mario Party Jamboree","2024-11-01"
"BYrzQ82ZyWI","Narcissist Streamer Reacts to Himself - Jabroni Mike: Director's Commentary","2024-02-16"
"6nLYm335iOk","Naruto Ultimate Ninja Storm - Part 1 - Jabroni Mike Full Streams","2018-09-06"
"nwjyWXAJmm0","Naruto Ultimate Ninja Storm - Part 2 - Jabroni Mike Full Streams","2018-10-01"
"4SlO9dRAUus","Nathan's Chao Hotdogs - Sonic Adventure 2","2020-06-04"
"jS5Ik95d7L0","Navigating the Flabyrinth - Mario and Luigi: Bowser's Inside Story","2022-05-10"
"gfsZgYF_QNA","Navigating the Lands Between - GeoGuessr + Elden Ring","2022-05-26"
"jGDgRBf739s","Nemesis Of My Nemesis - Resident Evil 3 Remake","2020-05-03"
"_jCqzQZaBdU","Nep Nep - 5/31/17 - Jabroni Mike: Full Streams","2017-06-02"
"Yqs-m5chh0M","Never Give a Sword to a Pokeman Who Cant Dance - Pokemon Sword","2019-11-23"
"2KR9dnRcDZY","New Pokemon Cringe Comp - New Pokemon Snap","2021-05-01"
"6JpVSP0u52I","New York Comic Con 2024 With A Very Special Guest...","2024-10-19"
"rSOlKkEZjX4","Nexpansion - Pokemon Legends Arceus","2022-02-16"
"4AllJPMD2MI","Nickelodeon All-Star Brawl 2 - Jabroni Mike","2023-11-08"
"l0BimPz4AxI","Night of Many Updates - Animal Crossing: New Horizons + Super Smash Bros. Ultimate","2021-03-05"
"ET5Rn_jYcG8","Night of the Living Meat - Carrion","2020-07-28"
"Loeuw7nMoP4","NiGHTS: Into Dreams - Jabroni Mike Full Streams","2019-02-08"
"11doF2uYIgU","Nintendo LABO Robot Kit Unboxing & Assembly - Jabroni Mike Full Streams","2018-04-23"
"yv8HnX9BbQg","Nintendo LABO Variety Kit Piano Unboxing & Assembly - Jabroni Mike Full Streams","2018-04-26"
"CHZ0VT-ky-w","Nintendo LABO Variety Kit Unboxing & Assembly - Jabroni Mike Full Streams","2018-04-21"
"h6YCvT5A5rQ","Nintendo Thick Direct + Noita Malding - Jabroni Mike","2023-06-21"
"4vPtLMDGfBg","Nintendongs","2015-03-04"
"1wZXUZY1qGo","No Electricity Simulator - The Forest w/ RevScarecrow!","2020-08-11"
"GKCEdFEYYPM","No Man's Sky - 07/26/18 - Jabroni Mike Full Streams","2018-07-27"
"f5FmahuevjM","No Man's Sky - 08/08/18 - Jabroni Mike Full Streams","2018-08-10"
"e9IV4bDDZn0","No Man's Sky - 08/10/18 - Jabroni Mike Full Streams","2018-08-11"
"75XCMRd1U2Y","No Man's Sky - 11/05/18 - Jabroni Mike Full Streams","2018-11-07"
"3F0clUwHWCk","Nook's Collection Service - Animal Crossing: New Horizons","2020-03-23"
"saPLa-c32Pg","Not From Concentrate - Jabroni Juicebox #7","2020-02-10"
"GQa1XeNy9es","Nothing Beats a Jam-Filled Crumpet - Pokemon Sword","2019-11-21"
"7C9E8WNJXFY","Nothing Personnel, Kid - Sonic Adventure 2 Mods + Viewer OC's","2020-07-06"
"zxf8QOZoBEA","Nuclear Throne + Always Sometimes Monsters + ARK","2015-07-02"
"kxd27fkhia4","Nuclear Throne - 5/13/17 - Jabroni Mike: Full Streams","2017-05-13"
"A42GNlwjNS8","Nuclear Throne and Isaac Afterbirf","2016-01-12"
"dq4YFywKJLY","Nuclear Throne and Isaac Afterbirf","2016-01-12"
"jFU_hO8w_6o","Nuclear Throne and Isaac Afterbirf","2016-01-12"
"lU3_K_UAlzY","Nuclear Throne and Isaac Afterbirf","2016-01-12"
"6NHH0b1Jup4","Nuclear Throne then Alien Isolation","2015-12-01"
"1AU-jiQppW8","Nuclear Throne","2015-08-31"
"5aEErrgnGvg","Nuclear Throne","2015-09-15"
"8XEGrn44ns4","Nuclear Throne","2015-09-15"
"961M0FRQBrc","Nuclear Throne","2015-08-31"
"9D7R-1qz92c","Nuclear Throne","2015-08-31"
"Aa3hVnTvYgQ","Nuclear Throne","2015-09-11"
"Bz6M2vAp010","Nuclear Throne","2015-06-08"
"DC9FKoCA2tI","Nuclear Throne","2015-08-11"
"eoU6T8sxHMk","Nuclear Throne","2015-09-19"
"fcU6eUIR7to","Nuclear Throne","2015-08-31"
"FsQcKnehDvY","Nuclear Throne","2015-06-18"
"i9A6Ht_Bp3g","Nuclear Throne","2015-09-15"
"jZaiXaGFwFw","Nuclear Throne","2015-08-11"
"MQdUL4cz8CA","Nuclear Throne","2015-09-15"
"n7w7QqMb5HE","Nuclear Throne","2015-09-15"
"olRwzdL9jCI","Nuclear Throne","2015-09-16"
"t2FJCUQJHP8","Nuclear Throne","2015-07-07"
"wd9f-7mZROU","Nuclear Throne","2015-05-03"
"yb5SKmHP3pM","Nuclear Throne","2015-05-02"
"YiTaAMrXseQ","Nuclear Throne","2015-05-04"
"y_x7rQA6bSY","Nuclear Throne","2015-07-07"
"_1OA9IIhSI8","Nuclear Throne","2015-09-11"
"qLP08_F765Y","Nuclear Throne/ Binding of Isaac","2015-06-03"
"wB63vDUHWXg","Nuclear Throne/Binding of Isaac: Rebirth","2015-05-02"
"IQFfmAcvkDE","Nuclear Throne/FTL","2015-08-11"
"K5Bu9mg9rNc","Nuclear Throne/FTL","2015-08-11"
"go4GuvzQOU4","Nukular Throne","2015-04-27"
"iiQDsrNnkN8","Nukular Throne","2015-04-10"
"Zt-JdocXVdM","Nukular Throne","2015-04-27"
"X_gK8Oerbec","Nut Cracking ASMR - YouTube Night W/ Jabroni Mike","2023-03-02"
"xecuXyKt-6Y","Oblivion NPCs Browse YouTube + Saacing - YouTube With Rev/Binding of Isaac","2022-07-27"
"rXJc3GCQHmU","Octopath Traveller - Part 1 - Jabroni Mike Full Streams","2018-07-25"
"MmuGGz1QRvY","Octopath Traveller - Part 2 - Jabroni Mike Full Streams","2018-08-02"
"6iBqHswSDOA","Off the Grid Flattening - Paper Mario and the Origami King","2020-08-10"
"vZRMuBqSu2s","Official Hardware Woes - Conker's Bad Fur Day","2021-05-13"
"RO9O3LMj94I","Og The Misnery - AI Shenanigans (Dall E Mini, Open Ai, More!)","2022-07-18"
"oG3p5qpIKXQ","Oh God, It's Eyeballs - The Legend of Zelda: A Link to the Past","2022-04-29"
"zK_XgfEbAOA","Ohaiyo Guessr - Jabroni Mike GeoGuessr","2023-06-20"
"dAa2DxqmhkA","Okami HD - Part 1 - Jabroni Mike Full Streams","2018-07-03"
"MsFb-NEfjnA","Okami HD - Part 2 - Jabroni Mike Full Streams","2018-07-10"
"1ihFHmP0oNY","Okami HD - Part 3 - Jabroni Mike Full Streams","2018-08-01"
"19-PVp_CImc","Okami HD - Part 4 - Jabroni Mike Full Streams","2018-08-14"
"kFBc4pKUdm0","Okami HD - Part 5 - Jabroni Mike Full Streams","2018-08-24"
"45Z4k7l-jcM","Okami HD - Part 6 - Jabroni Mike Full Streams","2018-08-31"
"GAGV9jHVJfI","Old Man Yells At Square Cloud - Minecraft Vanilla (w/ Tristan!)","2019-09-21"
"uzREERfdB3I","Oldest Surfer On The Beach - Animal Crossing: New Horizons (and RE3 Remake!)","2020-05-04"
"dwgREETsRlU","One Particular Harbor - Animal Crossing: New Horizons","2020-05-03"
"acEu3l9F4us","One Way or Another Amy Edition - Sims 4 (Part 2)","2022-12-21"
"brajKvyzEnE","One-Winged Isaac - Isaac Afterbirth+","2020-12-11"
"vp741S70LPc","Only Up + Other Trash - Meme Game Monday Jabroni Mike","2023-06-26"
"2DyQyBdh0zw","Ooh, Banana - Super Monkey Ball: Banana Mania","2021-10-14"
"7oMsldLG0Do","Oops no it's Terraria","2015-08-13"
"ckA27NRjKCc","Oops no it's Terraria","2015-08-13"
"TVgUw5xb0_I","Orangecrantz And Applestern Are Dead ~ Earthbound","2019-12-23"
"Vu_8fBzaiDU","Oranges Update - No Man's Sky","2020-09-26"
"bY9iShJz8-I","Out Clubbin' - Mother 3","2020-09-21"
"GIshGpOhwJI","Out Clubbin' - Yakuza Kiwami","2021-08-17"
"ibrn50gZBf8","Overwatch - 12/21/18 - Jabroni Mike Full Streams","2018-12-22"
"dtm7t5dEjuw","P Rank Malding Noises - Pizza Tower Noise Update #4 Finale","2024-03-25"
"WNouytq8nUI","P Ranking Pizza Tower (Part 1) - Jabroni Mike","2023-03-01"
"TQ7gzyaQ2s0","P Ranking Pizza Tower (Part 3) - Jabroni Mike","2023-03-10"
"sV2-zN9G9Nc","P Ranking Pizza Tower (Part 5) - Jabroni Mike","2023-03-17"
"qxbN-qk-lMM","P Ranking Pizza Tower (Part 6) - Jabroni Mike","2023-03-27"
"8wc3eaX-3Fg","P Ranking Pizza Tower 100% (Part 7) - Jabroni Mike","2023-04-01"
"XcTzPOiR1gk","P Ranking Pizza Tower 101% (Part 8 Finale) - Jabroni Mike","2023-04-05"
"VzbaTw36i9U","Palette Swapped Men - Palworld - Jabroni Mike","2024-01-22"
"e12tfrnfK8A","Papa's Getting Shut Down By The Health Department - Jabroni Mike","2023-04-22"
"39bHZA4iUn0","Papa's Meat & Fun - Jabroni Mike Papa's Games","2023-05-03"
"n2-XhZ_6llk","Papers on a Train - Paper Mario: The Thousand Year Door","2021-01-11"
"IujkHrcSVEo","Paradise Found - Animal Crossing: New Horizons","2020-04-14"
"0Nvhym2iDns","Paranormal Plundering - Phasmophobia w/ RevScarecrow!","2020-10-20"
"4CV8mOdkXH4","Part Time Noita, Full Time Pain - Part Time UFO + Noita","2020-11-06"
"6TLWFITWBzY","Party All the Time! - Mario Party Superstars (w/ Vinny, RevScarecrow, and Limealicious!)","2021-11-10"
"um-5FU1hRiU","Party, Party, Party! - Mario Party Superstars","2021-10-31"
"-TjmQm6rFUc","PastaRizon - Sims 4 (Part 6)","2023-01-16"
